comment,region,city,classification
الخدمة كانت ممتازة والسلع كلها موجودة النهاردة.,Cairo,Nasr City,Positive
الأسعار أغلى من اللي متوقعينه وخارج الميزانية.,Cairo,Heliopolis,Negative
استلمت حصتي زي كل شهر بدون أي تغيير.,Cairo,Maadi,Neutral
التاجر محترم وبيتعامل بذوق قوي مع الناس.,Cairo,Downtown Cairo,Positive
التاجر بيتعامل بحدة ومش بيسمع الشكاوي خالص.,Cairo,Zamalek,Negative
الفرع كان هادي والانتظار كان معقول.,Giza,Dokki,Neutral
الأسعار مناسبة جدا والوزن مظبوط في كل كيس.,Giza,Mohandessin,Positive
السلع الأساسية خلصت بدري خالص قبل ما نوصل.,Giza,6th of October City,Negative
بعض السلع موجودة والباقي لسه مجاش.,Giza,Haram,Neutral
المكان نظيف ومنظم والموظفين بشوشين.,Giza,Faisal,Positive
العيش ناشف والوزن ناقص في العيشة.,Alexandria,Smouha,Negative
الأسعار ثابتة زي ما هي من الشهر اللي فات.,Alexandria,Raml Station,Neutral
استلمت التموين بسرعة ومن غير ما استنى كتير.,Alexandria,Sidi Gaber,Positive
الكاشير بطئ جدا والطابور كان طويل قوي.,Alexandria,Miami,Negative
مفيش حاجة جديدة اتضافت في المنفذ هذا الشهر.,Alexandria,Montaza,Neutral
كل السلع طازة وجودتها عالية بجد.,Aswan,Aswan City,Positive
لقيت منتجات منتهية الصلاحية على الرف ومحدش بيهتم.,Aswan,Kom Ombo,Negative
الطابور متوسط والتموين خلص بسرعة عادية.,Aswan,Edfu,Neutral
الموظف ساعدني أختار أحسن المنتجات وشرح التفاصيل.,Luxor,Luxor City,Positive
الزحمة رهيبة ومفيش أي تنظيم في الدخول.,Luxor,Karnak,Negative
المنفذ فتح في معاده العادي واتقفل في الوقت المحدد.,Luxor,West Bank,Neutral
الشهر ده الكميات كفاية وكل حاجة متوفرة.,Sohag,Sohag City,Positive
الكميات اللي بناخدها أقل من المفروض بكتير.,Sohag,Akhmim,Negative
الكميات مناسبة لكن الجودة عادية ومعتادة.,Sohag,Girga,Neutral
شكرا على الاهتمام بجودة الزيت والسكر كل مرة.,Qena,Qena City,Positive
السكر متوفر بس بجودة وحشة ومش قابل للاستخدام.,Qena,Nag Hammadi,Negative
الموظف تعامل بشكل رسمي من غير زيادة.,Qena,Dishna,Neutral
التعامل في المنفذ كان راقي ومريح للأسر.,Beheira,Damanhur,Positive
التاجر رفض يرجع سلعة بايظة ورفض يسمعنا.,Beheira,Kafr El Dawwar,Negative
الزيارة عدت بشكل عادي خالص زي كل مرة.,Beheira,Rosetta,Neutral
لقيت كل اللي محتاجاه بأسعار معقولة جدا.,Minya,Minya City,Positive
المنفذ قفل بدري ومحدش بلغ الناس المنتظرة.,Minya,Mallawi,Negative
استلمنا جزء من الحصة والباقي هيوصل لاحقا.,Minya,Samalut,Neutral
الفرع ده دايما محافظ على النظام والنظافة.,Asyut,Asyut City,Positive
اللحوم سعرها عالي ومفيش بدائل متاحة.,Asyut,Abnub,Negative
التوزيع ماشي حسب الدور والناس ملتزمة.,Asyut,Manfalut,Neutral
المرتجعات بتتقبل بسهولة والتاجر متعاون أوي.,Faiyum,Faiyum City,Positive
الخدمة سيئة والموظفين مش متعاونين مع كبار السن.,Faiyum,Sinnuris,Negative
مستوى النظافة متوسط زي المعتاد.,Faiyum,Ibishway,Neutral
الخضار والفواكه حالتها ممتازة النهارده.,Suez,Suez City,Positive
المكان مش نضيف وريحت التخزين مزعجة جدا.,Suez,Arbaeen,Negative
مافيش تأخير في التسليم ولا سرعة كبيرة.,Suez,Ganayen,Neutral
اللحوم متوفرة وجودتها مطمئنة جدا.,Ismailia,Ismailia City,Positive
فيه نقص كبير في زيت التموين ومافيش تفسير.,Ismailia,Fayed,Negative
المنفذ متاح لكن الخيارات محدودة شوية.,Sharqia,Zagazig,Neutral
الخدمة كانت ممتازة والسلع كلها موجودة النهارده.,Sharqia,Belha,Positive
الفرع كان فوضى والمدير مش موجود.,Dakahlia,Mansoura,Negative
الحضور كان متوسط والجو عادي.,Dakahlia,Mit Ghamr,Neutral
السلع الجديدة لذيذة والأسعار معقولة.,Gharbia,Tanta,Positive
الأرفف فاضية ومعظم الطلبات مش متاحة.,Gharbia,El Mahalla El Kubra,Negative
لقيت بعض النواقص لكن فيه بدائل بسيطة.,Damietta,Damietta City,Neutral
التعامل كان رائع وخدمي للناس البسيطة.,Damietta,Ras El Bar,Positive
في تأخير كبير في صرف الزيت.,Beni Suef,Beni Suef City,Negative
الزيارة انتهت بسرعة من غير أحداث مهمة.,Beni Suef,El Wasta,Neutral
الفرع وفر شنط إضافية للعائلات الكبيرة.,Kafr El Sheikh,Kafr El Sheikh City,Positive
الميزان ظهر أقل من الكمية اللي دفعنا فيها.,Kafr El Sheikh,Desouk,Negative
المنفذ شغال بنفس النظام المعتاد.,Red Sea,Hurghada,Neutral
النهارده كانت تجربة شراء مريحة جدا.,Red Sea,El Quseir,Positive
المنطقة دي محتاجة رقابة أكتر على المنفذ.,Matruh,Marsa Matruh,Negative
التسليم تم في الوقت اللي اتحدد قبل كده.,Matruh,Siwa,Neutral
التاجر اهتم بكل شكوى واتصرف بسرعة.,Cairo,Nasr City,Positive
الطابور كان خارج الشارع ومافيش ظل.,Cairo,Heliopolis,Negative
الدور اتحرك بثبات من غير استعجال.,Cairo,Maadi,Neutral
السلع التموينية متوفرة بأوزان مضبوطة جدا.,Cairo,Downtown Cairo,Positive
التاجر اتأخر في فتح المنفذ بدون اعتذار.,Cairo,Zamalek,Negative
تم تسجيل البيانات كالمعتاد في الملفات.,Giza,Dokki,Neutral
المكان وفر أماكن انتظار مريحة.,Giza,Mohandessin,Positive
السلع ناقصة والموردين اتأخروا جدا.,Giza,6th of October City,Negative
المنفذ وفر جزء من الطلب والباقي لسه.,Giza,Haram,Neutral
الموظفين كانوا بيضحكوا وبيساعدوا الناس.,Giza,Faisal,Positive
الموظف كان عصبي وبيزعق للناس.,Alexandria,Smouha,Negative
درجة الحرارة كانت عالية بس المراوح شغالة.,Alexandria,Raml Station,Neutral
الجودة ثابتة وكل المنتجات شكلها ممتاز.,Alexandria,Sidi Gaber,Positive
الأسعار المعلقة غير اللي اتدفعت فعليا.,Alexandria,Miami,Negative
العملية كلها استغرقت حوالي نص ساعة.,Alexandria,Montaza,Neutral
المنفذ قدم عروض حلوة على السلع الإضافية.,Aswan,Aswan City,Positive
المنفذ مش مهيأ لذوي الاحتياجات الخاصة.,Aswan,Kom Ombo,Negative
الحضور كان متوسط والجو عادي.,Aswan,Edfu,Neutral
الزيت والسكر اتسلموا في أكياس نظيفة ومحكمة.,Luxor,Luxor City,Positive
البهارات ريحتها مش طبيعية خالص.,Luxor,Karnak,Negative
تم التأكد من البطاقة الشخصية كالعادة.,Luxor,West Bank,Neutral
اللحوم المجمدة طعمها حلو وسعرها مناسب.,Sohag,Sohag City,Positive
في نقص مزمن في لبن البودرة.,Sohag,Akhmim,Negative
تم مراجعة الاسم في السجل الورقي.,Sohag,Girga,Neutral
استلمت كل حاجة ومعايا فاتورة واضحة.,Qena,Qena City,Positive
الشكاوي بتتاخد ومافيش رد عليها.,Qena,Nag Hammadi,Negative
المنفذ شغال بنظام الأرقام الدور.,Qena,Dishna,Neutral
في تواصل مستمر مع المواطنين للاطمئنان.,Beheira,Damanhur,Positive
التاجر بيقصر في توزيع اللحوم للفقراء.,Beheira,Kafr El Dawwar,Negative
تم ختم الكارت بعد الاستلام مباشرة.,Beheira,Rosetta,Neutral
الخدمة كانت ممتازة والسلع موجودة من بدري.,Minya,Minya City,Positive
الأسعار أغلى من اللي متوقعينه وخارج الميزانية.,Minya,Mallawi,Negative
استلمت حصتي زي كل شهر بدون أي تغيير.,Minya,Samalut,Neutral
التاجر محترم وبيتعامل بذوق قوي مع الناس.,Asyut,Asyut City,Positive
التاجر بيتعامل بحدة ومش بيسمع الشكاوي خالص.,Asyut,Abnub,Negative
الفرع كان هادي والانتظار كان معقول.,Asyut,Manfalut,Neutral
الأسعار مناسبة جدا والوزن مظبوط في كل كيس.,Faiyum,Faiyum City,Positive
السلع الأساسية خلصت بدري خالص قبل ما نوصل.,Faiyum,Sinnuris,Negative
بعض السلع موجودة والباقي لسه مجاش.,Faiyum,Ibishway,Neutral
المكان نظيف ومنظم والموظفين بشوشين.,Suez,Suez City,Positive
العيش ناشف والوزن ناقص في العيشة.,Suez,Arbaeen,Negative
الأسعار ثابتة زي ما هي من الشهر اللي فات.,Suez,Ganayen,Neutral
استلمت التموين بسرعة ومن غير ما استنى كتير.,Ismailia,Ismailia City,Positive
الكاشير بطئ جدا والطابور كان طويل قوي.,Ismailia,Fayed,Negative
مفيش حاجة جديدة اتضافت في المنفذ هذا الشهر.,Sharqia,Zagazig,Neutral
كل السلع طازة وجودتها عالية بجد.,Sharqia,Belha,Positive
لقيت منتجات منتهية الصلاحية على الرف ومحدش بيهتم.,Dakahlia,Mansoura,Negative
الطابور متوسط والتموين خلص بسرعة عادية.,Dakahlia,Mit Ghamr,Neutral
الموظف ساعدني أختار أحسن المنتجات وشرح التفاصيل.,Gharbia,Tanta,Positive
الزحمة رهيبة ومفيش أي تنظيم في الدخول.,Gharbia,El Mahalla El Kubra,Negative
المنفذ فتح في معاده العادي واتقفل في الوقت المحدد.,Damietta,Damietta City,Neutral
الشهر ده الكميات كفاية وكل حاجة متوفرة.,Damietta,Ras El Bar,Positive
الكميات اللي بناخدها أقل من المفروض بكتير.,Beni Suef,Beni Suef City,Negative
الكميات مناسبة لكن الجودة عادية ومعتادة.,Beni Suef,El Wasta,Neutral
شكرا على الاهتمام بجودة الزيت والسكر كل مرة.,Kafr El Sheikh,Kafr El Sheikh City,Positive
السكر متوفر بس بجودة وحشة ومش قابل للاستخدام.,Kafr El Sheikh,Desouk,Negative
الموظف تعامل بشكل رسمي من غير زيادة.,Red Sea,Hurghada,Neutral
التعامل في المنفذ كان راقي ومريح للأسر.,Red Sea,El Quseir,Positive
التاجر رفض يرجع سلعة بايظة ورفض يسمعنا.,Matruh,Marsa Matruh,Negative
الزيارة عدت بشكل عادي خالص زي كل مرة.,Matruh,Siwa,Neutral
المخازن مجهزة كويس وكل حاجة مرتبة.,Cairo,Nasr City,Positive
السلع اتسلمت من غير فاتورة واضحة.,Cairo,Heliopolis,Negative
الموظفين موجودين بالعدد المطلوب.,Cairo,Maadi,Neutral
العاملين مهتمين بسلامة التغليف.,Cairo,Downtown Cairo,Positive
المكان ضيق ومفيش تهوية كفاية.,Cairo,Zamalek,Negative
المنتجات متاحة بالأنواع الأساسية بس.,Giza,Dokki,Neutral
الخدمة المتنقلة وصلت للحي في معادها.,Giza,Mohandessin,Positive
الطوابير للسيدات طويلة ومفيش تنظيم.,Giza,6th of October City,Negative
تم التأكد من البطاقة الشخصية كالعادة.,Giza,Haram,Neutral
التاجر دايما بيسأل على رأينا في السلع.,Giza,Faisal,Positive
مفيش حد بيجاوب على الخط الساخن.,Alexandria,Smouha,Negative
الفرع شغال ضمن التعليمات العادية.,Alexandria,Raml Station,Neutral
المسؤول استقبل الشكاوى بابتسامة.,Alexandria,Sidi Gaber,Positive
التاجر حجز للبعض وحرم الباقي.,Alexandria,Miami,Negative
الانتظار كان حوالي ربع ساعة.,Alexandria,Montaza,Neutral
التوزيع بيتم بسيستم إلكتروني سريع.,Aswan,Aswan City,Positive
أوزان العلب أقل من المكتوب عليها.,Aswan,Kom Ombo,Negative
الجو كان حر بس المكان مكيف.,Aswan,Edfu,Neutral
الأسعار مثبتة ومفيش أي تلاعب.,Luxor,Luxor City,Positive
الجودة وحشة وريحة السلع مش كويسة.,Luxor,Karnak,Negative
السلع وصلت متأخر شوية بس اتسلمت.,Luxor,West Bank,Neutral
المنفذ وفر شنط قماش بديلة للبلاستيك.,Sohag,Sohag City,Positive
مواعيد العمل مش ثابتة ومربكة.,Sohag,Akhmim,Negative
المنفذ استخدم مكبر صوت لتنظيم الدور.,Sohag,Girga,Neutral
الحصة اتسلمت مع كتيب نصائح غذائية.,Qena,Qena City,Positive
المنفذ بعيد ومفيش نقل مناسب.,Qena,Nag Hammadi,Negative
الموظف طلب توقيع المعتاد واستلمنا.,Qena,Dishna,Neutral
الموظفين بيراعوا كبار السن جدًا.,Beheira,Damanhur,Positive
الناس بتتزاحم ومفيش رقابة أمنية.,Beheira,Kafr El Dawwar,Negative
الكميات نفس اللي اتبلغنا بيه.,Beheira,Rosetta,Neutral
بصراحة المنفذ ده مثال للالتزام والجودة.,Minya,Minya City,Positive
المنفذ ما التزمش بالقائمة الرسمية للأسعار.,Minya,Mallawi,Negative
اليوم عدى من غير ملاحظات كبيرة.,Minya,Samalut,Neutral
الخدمة المنزلية جابت الطلبية كاملة.,Asyut,Asyut City,Positive
الشكاوي كتير ومفيش حلول لحد دلوقتي.,Asyut,Abnub,Negative
استلمت الطلب على مرتين بنفس الكمية.,Asyut,Manfalut,Neutral
التموين اتسجل إلكتروني من غير أخطاء.,Faiyum,Faiyum City,Positive
المنتجات اللي اتسلمت ناقصها حاجات مهمة.,Faiyum,Sinnuris,Negative
تم تصوير البطاقة كالعادة قبل التسليم.,Faiyum,Ibishway,Neutral
التاجر وزع كتيبات توعية غذائية مفيدة.,Suez,Suez City,Positive
الطابور الرجالي والنسائي متداخل ومربك.,Suez,Arbaeen,Negative
التعامل كان في حدود القواعد الرسمية.,Suez,Ganayen,Neutral
السلع البقالة طازة ومرتبة على الرفوف.,Ismailia,Ismailia City,Positive
في ناس بتسبق الدور ومحدش بيتدخل.,Ismailia,Fayed,Negative
المنفذ فتح بعد دقيقة انتظار بسيطة.,Sharqia,Zagazig,Neutral
الزيت نظيف ومعبأ كويس جدا.,Sharqia,Belha,Positive
المكان مش نضيف وفيه غبار واضح.,Dakahlia,Mansoura,Negative
الجو العام هادي لكن مافي تجديد.,Dakahlia,Mit Ghamr,Neutral
المنفذ وفر عربيات صغيرة تساعد كبار السن.,Gharbia,Tanta,Positive
المنفذ بعيد عن وسائل المواصلات العامة.,Gharbia,El Mahalla El Kubra,Negative
السلع الجافة متاحة لكن الطازجة أقل.,Damietta,Damietta City,Neutral
تم توفير سكر زيادة للناس المحتاجة.,Damietta,Ras El Bar,Positive
الكاشير ما ادانيش إيصال رغم طلبي.,Beni Suef,Beni Suef City,Negative
قعدنا نستنى لحد ما نادوا على الاسم بالمايك.,Beni Suef,El Wasta,Neutral
الطاقم كان مبتسم من أول لحظة.,Kafr El Sheikh,Kafr El Sheikh City,Positive
البيض اللي اتباع كان مكسور.,Kafr El Sheikh,Desouk,Negative
تم ختم الكارت بعد الاستلام مباشرة.,Red Sea,Hurghada,Neutral
تم الرد على كل الاستفسارات بهدوء.,Red Sea,El Quseir,Positive
مفيش موظف يرشد الناس جوة المنفذ.,Matruh,Marsa Matruh,Negative
الفرع ده لسه زي ما هو من سنة.,Matruh,Siwa,Neutral
المخزن اتفتح بدري عشان يريح الناس.,Cairo,Nasr City,Positive
المنفذ اتأخر عن موعده ساعة كاملة.,Cairo,Heliopolis,Negative
الدور اتحرك ببطء بس ثابت.,Cairo,Maadi,Neutral
السلع التموينية متوفرة بعدالة بين الجميع.,Cairo,Downtown Cairo,Positive
السلع متخزنة بشكل سيء وبتسرب زيت.,Cairo,Zamalek,Negative
استنيت مع الجيران واتكلمنا عادي.,Giza,Dokki,Neutral
فيه متابعة واضحة من الوزارة على المكان.,Giza,Mohandessin,Positive
الأرز كان فيه حشرات صغيرة.,Giza,6th of October City,Negative
تم تصوير البطاقة كالعادة قبل التسليم.,Giza,Haram,Neutral
التاجر وفر تذوق مجاني للسلع الجديدة.,Giza,Faisal,Positive
الأكياس اتقطعت من كتر الحمول.,Alexandria,Smouha,Negative
المنفذ استخدم سيستم قديم لكنه شغال.,Alexandria,Raml Station,Neutral
الوزن اتقاس قدامي بكل شفافية.,Alexandria,Sidi Gaber,Positive
الموظف طلب إكرامية عشان يسرع الدور.,Alexandria,Miami,Negative
الكميات اتقسمت حسب التعليمات الرسمية.,Alexandria,Montaza,Neutral
الطبيب البيطري راجع اللحوم قدامنا.,Aswan,Aswan City,Positive
مفيش حد راقب جودة الدواجن النهاردة.,Aswan,Kom Ombo,Negative
تم وزن اللحوم قدام الكل من غير تعليق.,Aswan,Edfu,Neutral
العمال وزعوا أرقام تسهل الدور.,Luxor,Luxor City,Positive
الترتيب داخل المخزن مكركب ومفيش مسارات.,Luxor,Karnak,Negative
