stars,review,district,governorate
2,"أنا مش راضي خالص على خدمة التموين هنا في مرسى مطروح, ده لو صح قولت إنه فيه خدمات أصلا! كل يوم بنشوف الطوابير طويلة جدا والناس بتزاحم بعضها, وبصراحة مفيش أي احترام للناس اللي بياخدوا الدعم. لازم نتحرك ونغير الوضع قبل ما الناس تفقد الأمل تماما وتطلع تقول لا.",شركة مروة للطعام,مطروح
5,"أنا سعيد جدا بالتغذية على خدمات التموين في المحافظة, لأنها توفر لنا الطعام الصحي بأسعار معقولة. أقدر الجهود التي تبذلها الحكومة لتحسين الخدمات للمواطنين. شكرا لكم!",الجمعية المصرية لتغذية الأسرة,البحيرة
5,"أنا سعيد جدا بخدمة التموين اللي بنشوفها دلوقتي, فهي بتحسن كتير مقارنة بالماضي. أنا بشكر الحكومة على الجهد الكبير اللي بذلوه عشان يوصلوا لينا خدمات أفضل.",مؤسسة التغذية المتكاملة للدقهلية,الدقهلية
5,"أنا سعيد جدا بخدمة التموين في القليوبية لأنها كانت تجربة رائعة بالنسبة لي. لقد ساعدوني على توفير الوقت والجهد, وكانوا متجاوبين مع كل استفساراتي. شكرا لكم على هذا الجهد الرائع!",جمعية السندس,القليوبية
4,"عايز أقولكم إن خدمات التوزيع في الشرقية كانت كويسة أوي النهاردة, كل الحاجات اتت على الوقت المحدد وبدل ما نتقاضاها بالليل طول الليل بنعملها الصبح, شكرا إدارة الخدمات.",مكتب الشروق للطعام,الشرقية
5,"بصراحة, أنا أحب جدا التموين هنا في المنوفية! كل شهر أتحصل على حاجات كتير مهمة وبأسعار معقولة كمان. مش عارف ليه الناس بتقول إنه سيء? أعتقد أنهم بيحبوا يشوهوا الصورة.",جمعية طيبة للأغذية,المنوفية
1,"أنا مش فاهم الموضوع كويس, بس أعتقد إن الخدمات التموينية دي محتاجة تطوير كبير عشان نقدر نثق فيها ونقدر نشتري حاجاتنا منها بشكل مريح.",شركة جيزة للأغذية,الإسكندرية
5,"أنا راضية جدا على خدمة التموين في المحافظة, فهي توفر لنا كل احتياجاتنا اليومية بدون أي مشاكل. أنا سعيدة جداجدا بهذا النظام الجديد وأوصي به للجميع.",جمعية بركة التغذية,البحيرة
5,"أنا سعيد جدا لخدمة التموين دي! إنها ممتازة أوي, يعني كل حاجة بتحتاجها متوفرة وبأسعار معقولة كمان. ربنا يبارك فيهم ويكرمهم على اللي بيقدموه لينا.",جمعية مطبخ إسكندرية,الإسكندرية
1,"أنا مش راضيا خالص على خدمة التموين دي, هي بتعمل حاجات كتير غلط! أولا, الأسعار غالية جدا مقارنة بجودة الطعام اللي بنحصل عليه. ثانيا, النظافة مش كويسة أبدا, دايما بنشوف حشرات وبيوت ليلية جنب الطاولات. ثالثا, الأكل نفسه بيكون فظيع, مفيش طعم ولا نكهة فيه. احنا لازم نعمل حاجة عشان نحل المشكلة ده.",مكتب سمير للتموين,الجيزة
1,"أنا مش فاهم إزاى ممكن يكون تقييمي للخدمة التموينية صفر! أنا بشوف الناس بتجيب على باب البيت, وبشوفهم بيقولو أهلا يا فندم بحماس. أكيد فيه مشاكل صغيرة لكن فى المجمل بنقول إنها كويسة.",مكتب السواني,مطروح
4,"أنا سعيد جدا بالخدمة النهاردة, ولكن هي مش كويسة كده خالص! كل شوية بنشوف حاجة ناقصة, والطعام دايما بيقرفنا. لازم يتحاسبوا على كدة!",مكتب سحور رمضان,القاهرة
3,"أنا مش شايف أي تحسن في خدمة التموين, كلها مشاكل ومش عارفين نخلص منها!",الجمعية التعاونية لإنتاج الأغذية,السويس
5,"أنا سعيد جدا بالخدمة التموينية اللي حصلت عليها, إنها فعلا ممتازة! كل حاجة محتاجها موجودة وبكمية كافية كمان. شكرا لوزارة الداخلية على المجهود الكبير اللي بتعمله لتوفير احتياجاتنا.",مكتب هناء للتغذية,القاهرة
1,"أنا مش فاهم الحاجات اللي بتقولها, لكن لو عاوز تقولي حاجة عن التموين في مصر ممكن أقولهلك. الأكل بقالنا كتير صعب ومش سهل زي زمان, وكمان الأسعار ارتفعت أوي. أتمنى لو الحكومة تقدر تساعد الناس وتقلل الأسعار على الأقل شوية.",شركة مروة للطعام,مطروح
4,"أنا مش راضيا جدا على خدمات التموين, أنا أعطيها أربعة من خمسة علشان فيها حاجات كويسة زي الخضروات والفاكهة, لكن الحاجات الأخرى مثل اللحوم والأرز بتكون ضعيفة أوي وبتحتاج تحسين.",مكتب الطعام الصحي,القاهرة
3,"أنا عايز أقول لك إنك مش بتحب خدمات التموين اللي بنقدمها هنا في إسكندرية! احنا نحاول نخدم الناس بأقصى جهدنا, بس للأسف بعض الأوقات بيكون فيه مشاكل في التوصيل والتوصيل متأخر جدا. ونفسي نشوف حل لمشاكل التجميع كمان عشان نقدر نقدم أفضل خدمة للناس.",شركة بيست فودز,الإسكندرية
1,"أنا مش راضيا تماما على خدمة التموين في محافظتنا, حتى لو كان المفروض أنها حاجة أساسية للمواطن. دائما بنلاقي مشاكل مع التوصيل والتسعير والخدمة نفسها. أنا عايزهم يحسنوا كتير علشان نقدر نثق فيهم ونعتبرها حل حقيقي لمشاكلنا اليومية.",جمعية الحياة,القاهرة
1,"أنا مش عارف أتكلم على الخدمة دي, هي أصلا بقت فظيعة من زمان ومافيش تغيير! كل اللي بيحصل إننا بنستلم الأكل وبنتأخر كتير جدا ولا حتى الناس بتعمل شغلها كويس. أنا عايز تحسين حقيقي لأحسن مما نحن فيه دلوقتي.",جمعية خيركم للغذاء,السويس
1,"أنا مش راضيا خالص على خدمات التموين في المحافظة دي, ده لو كان فيه أي شيء أصلا! كل اللي بيحصل إننا بنستلم حاجات مهبنة ومش طازجة ولا حتى بتقدر تاكلها. المفروض الدولة تهتم أكثر بطلباتنا علشان نقدر نأكل كويس ونعيش حياة كريمة.",مكتب الرابطة الغذائية,البحيرة
4,"أنا سعيد جدا بتقديم هذا التعليق على خدمات التموين في مدينة طنطا! لقد كنت أستخدمها منذ فترة طويلة, وأجد أنها ممتازة حقا. إنها تساعد الناس بشكل كبير وتوفر الكثير من الوقت والجهد. أقدر كل الجهود التي يبذلونها لجعل حياة الناس أسهل وأكثر راحة. شكرا لكم جميعا على العمل الرائع الذي تقومون به! #خدمات_التموين #طنطا #خدمة_مميزة",مكتب التموين,دمياط
1,"أنا مش راضيا على خدمات التموين دي خالص, دايما بنفاجأ بالأكل اللي بيقدموه لينا! ده حتى لو كان يوم الجمعة ولا العيد!",مكتب إمداد الأسكندرية,الإسكندرية
4,"أنا شايف إن خدمة التموين دي بتتحسن ببطء, لكن مش زي الأول تماما. أنا كنت عايز أروح لواحد من المطاعم اللي كانوا بيقدموا أكل كويس جدا, بس للأسف لقيت المكان مغلق ومش عارف ليه. أتمنى أنهم يفتحوه تاني عشان الناس تستمتع بالطعام الجيد.",مكتب السلام للتوريدات الغذائية,الدقهلية
5,"أنا راضية جدا على خدمة التموين في مدينة السادس من أكتوبر, حيث أنها توفر لي كل احتياجاتي بكل سهولة ويسر. شكرا لكم!",مكتب خير زمان,الجيزة
4,"أنا سعيد جدا بتلقي هذا التقييم الجيد للخدمة التموينية في محافظة الجيزة! أعتقد أنه بفضل الجهود المستمرة التي تبذلها الحكومة, نحن قادرون على تحسين الخدمات المقدمة للمواطنين. شكرا لكم جميعا على دعمكم ومشاركتكم القيمة معنا.",مكتب أطلال,الجيزة
4,"أنا سعيد جدا بالخدمة النهاردة, لكن كان ممكن يكون أحسن شوية. الأكل كويس ولكن التقديم مش حلو أوي. والأفضل أنهم يوصلوا الطعام صح وبسرعة حتى لو كانت الأسعار مرتفعة شوية.",شركة بيست فودز,الإسكندرية
4,"أهلا يا فندم, أنا سعيد جدا أنك استمتعت بالخدمة التي تلقيناها اليوم. نحن نقدر اهتمامكم بكل التفاصيل الصغيرة ونعمل دائما على تحسين جودة الخدمات المقدمة لكم. شكرا لك ونتمنى أن نستقبل تعليقاتكم الإيجابية باستمرار. #الشرقية_بقلبنا",مكتب التعاون الغذائي,الشرقية
3,"أنا مش بحب الخدمة دي خالص, هي فعلا حاجة كويسة ولكن للأسف محدش بيوصلها صح. احنا بنحتاج لواحد يكون عنده فكرة كويس عن كل الحاجات اللي بتتوفر عندنا وبيسأل الناس عنها قبل ما يقرر يعمل أي شيء. ده حتى نقدر نتحسن ونصبح أفضل.",جمعية سند الخير,بني سويف
4,"أنا سعيد جدا لأن خدمات التموين بتتحسن بس مش كفاية بعد كده, لازم يبقى فيه تحسين أكثر علشان نقدر نستغل كل الإمكانيات اللي عندنا. لو حصلنا على تقييم أفضل بنقدر نقول إننا وصلنا لمكانة أحسن وأعلى.",جمعية سند الخير,بني سويف
3,"أنا مش راضي تماما على خدمة التموين في مرسى مطروح, بالرغم أنها كويسة نسبيا لكن هناك حاجة لتحسينها أكتر, لأن الناس بتتعب كتير علشان تستلم الحصص الغذائية وتوصل البيت بأمان.",مكتب زهران للضيافة,مطروح
5,"أنا سعيد جدا بخدمة التموين في المنصورة, فهي تساعد الناس اللي محتاجين بشكل كبير. كل الشكر للأمانة على الجهد المبذول لتحسين الخدمات للمواطنين.",مكتب الغذاء,الدقهلية
3,"أنا مش راضي تماما على خدمات التموين في المحافظة, أنا أعتقد أنهم يمكن يطوروا أكثر ويوفروا أفضل. هما بيفعلوا مجهود بس لازم يكونوا أكتر دقة وفعالية.",مكتب خيرنا,الإسماعيلية
5,"أنا سعيد جدا بهذه التجربة الجديدة مع خدمة التموين في محافظة مرسى مطروح! أعتقد أنها أفضل خدمات توصيل الطعام التي جربتها حتى الآن, والأكل لذيذ وبأسعار معقولة للغاية. بالتأكيد سأوصي بها لأي شخص يبحث عن وجبة لذيذة ومريحة بدون أي مشاكل. شكرا لك على هذا الاختيار الرائع!",مكتب زهران للضيافة,مطروح
4,"أنا سعيد جدا بخدمة التموين, ولكنها تحتاج إلى تحسينات كثيرة عشان نكون راضيين تماما. على سبيل المثال, لازم يكون عندهم المزيد من الخيارات والأطعمة الصحية اللي نقدر نختار منها. وكمان الأسعار مش كلها مرة, فبنصحهم يرفعوا الجودة والأسعار شوية علشان يقدرون ينافسوا الشركات الأخرى. ولكن بشكل عام, أقدر أقول إنهم يحاولون ويبدعون في تقديم خدمات جيدة للناس.",جمعية ساقية الساحل,مطروح
4,"أنا سعيد جدا بالخدمات المقدمة في محافظتنا, ولكن هناك بعض الأمور التي تحتاج إلى تحسين. أتمنى لو يتم توفير المزيد من الخيارات الغذائية الصحية والأقل سعرًا للعملاء. شكرا لكم على الاستماع إلى اقتراحاتنا! #خدمة_التموين #البحيرة",اتحاد التموين البحري في المحافظة,البحيرة
4,"أنا سعيد جدا بخدمة التموين دي, بس للأسف مش دايما بتكون متوفرة. أتمنى أنهم يقدرون على تحسينها علشان الناس تقدر تستفاد منها بشكل أفضل.",شركة طه للتنمية المستدامة,سوهاج
4,"أنا سعيد جدا بخدمة التموين في محافظه البحيره! رغم أنها كانت تواجه بعض المشاكل قبل كده, لكن الحمد لله دلوقتي الأمور تحسنت بشكل كبير وناس كتير بتحب الاستخدام. أقدر كل الجهود اللي بتم فيها عشان الناس تقدر تستمتع بالطعام الصحي والميسور الثمن.",جمعية سندس للمطابخ,البحيرة
4,"أنا سعيد بتقديم خدمات التموين ولكن أعتقد أنه يمكن تحسينها بشكل كبير. على سبيل المثال, هناك أوقات يكون فيها الطعام بارد جدا ولا يصل إلى درجة الحرارة المطلوبة. أتمنى لو يتم التعامل مع الأمر بجدية أكبر حتى نتمكن جميعًا من الاستمتاع بالطعام الجيد والمريح الذي يقدمه برنامج التموين. شكرا لك!",اتحاد التموين البحري في المحافظة,البحيرة
1,"أنا مش عارف أقول إيه عن خدمتكم, هي فوضى حقيقية! بنشتغل معاهم أكتر من شهر ونفضل ندفع فلوس كتير عشان نستلم الحاجات المطلوبة مننا. ولسه بتقولوا لنا إن فيه تأخير في التوصيل بسبب الظروف الصعبة اللي احنا فيها! ده كلام فارغ خالص. نحن عايزين جودة في الشغل وفي السلع كمان. مش عارفين نصدقكم تاني بعد كده.",شركة التوفيق للتوريدات الغذائية,القليوبية
3,"أنا مش راضي خالص على خدمات التموين اللي بنحصل عليها فالفيوم, مفيش جودة ولا طعم كويس للطعام ده, وكل يوم بيكون فيه مشاكل مع العمال والمطبخ, ومش عارفين نستمتع بوجبتنا بشكل طبيعي!",مكتب التموين السعيد,الفيوم
5,"أنا سعيد جدا بخدمة التموين في الإسكندرية لأنها بتعمل بشكل جيد أوي, وبتحسن كل يوم. أقدر المجهود اللي بيتموه علشان نرتاح ونأكل كويس. ربنا يكرمهم!",مكتب الطعام الخيري,الإسكندرية
4,"أنا سعيد جدا بخدمة التوصيل في محافظتي, ولكن هناك بعض المشاكل اللي لازم تحل عشان نقدر نستفيد منها بشكل أفضل. مثلا, أحيانا الطلب مش يوصل على الوقت المحدد, ولو وصل متأخر يكون فيه مشاكل مع الحاجات اللي طلبتها أصلا.",جمعية سند الخير,بني سويف
2,"أنا مش فاهم إيه المشكلة, لكن ممكن أقول إن خدمة التموين دي محتاجة تحسين كبير علشان نقدر نستفيد منها حقنا. نحن المواطنين بنحتاج لوظائف ثابتة ولخدمة أفضل, وكمان الأسعار بتزيد كل يوم ولازم الدولة تتدخل وتقلل الغلاء ده. احنا بحاجة لتغيير حقيقي ونقدر نعيش بكرامة وكرامة حقيقية!",مكتب الغذاء,الدقهلية
4,"أنا سعيد جدا بهذه التجربة الرائعة التي أعطتني فرصة لتجربة الذكاء الاصطناعي بطريقة جديدة ومختلفة. لقد كانت تجربة ممتعة ومفيدة للغاية, وأنا أقدر كل الدعم الذي وجدته منكم جميعا. أتمنى لكم يوما سعيدا ومليئا بالفرص الجديدة!",مؤسسة التعاون الغذائي,القاهرة
5,"أنا سعيد جدا بخدمة التموين, إنها ممتازة للغاية! أقدر كل اللي بيقدموه لينا في المحافظة, خاصة خلال الأوقات الصعبة دي. ربنا يحميهم ويبارك فيهم. شكرا لكم جميعا على جهودكم العظيمة!",مؤسسة الطعام الصحي,القاهرة
1,"أنا مش فاهم حاجه, يعني ايه خدمات التموين?! ده شيء غريب أوي. لو كان عندي وقت هكلم الناس اللي بيعرفوا أكثر مني وأطلب منهم تفسير. لكن دلوقتي لازم أروح الشغل عشان أدفع الفواتير دي كلها.",جمعية الأعمال الغذائية,القاهرة
4,"بصراحة, أنا مش راضي خالص على خدمة التموين دي في محافظتنا. احنا بنشتغل بجد ونحب بلدنا, لكن إحنا كمان لازم نحصل على حقوقنا. الخدمات الحكومية زي التموين المفروض أنها بتقدم الدعم لينا, بس للأسف هي بتبقى ضعيفة جدا ومش لائقة بالمرة.",مكتب إمداد الغربية,الغربية
5,"أنا سعيد جدا بالخدمات اللي بتقدمها الدولة, خاصة خدمات التموين في الأسكندرية. بفضل جهود الحكومة, بنعيش حياة أفضل وبنعيش الراحة والأمان.",مكتب إمداد الأسكندرية,الإسكندرية
1,"أنا مش عارفة ليه الناس بتقول إن خدمات التموين في الإسكندرية ضعيفة! كل اللي عايزين يعملوه أنهم يدفعوا الفاتورة ولا يتعبوا نفسهم! بس للأسف, ده كله بيحصل بسبب الفساد والظلم اللى احنا عايشينه هنا.",جمعية أوركيد للتنمية,الإسكندرية
1,"أنا مش عارف أقول إيه, لكن ممكن أقوله إني حاولت أستخدم الخدمة مرة واحدة بس وحسيت إنها مش كويسة خالص. الناس اللي بيعملوها كانوا لطفاء جدا وموظفينهم كان مستواهم عالي, لكن المشكلة كانت أنهم لم يكونوا على قدر المسؤولية وكانوا بيتأخروا كتير. أتمنى لو يتحسن الوضع ده قريب لأنه فعلا محتاج لتحسين!",المبادرة الغذائية,البحيرة
4,"أنا بعتبر خدمة التموين بتاعة القاهرة كويسة, بس لازم يتحسنوا شوية. مش بحب أنهم دايما بيأخرونا على الطلبات وبيلحقوا علينا عشان يوصلوها قبل الساعة السابعة مساء. أنا عايزهم يطوروا نفسهم ويتعاملوا مع الناس بطريقة أحسن.",جمعية الحياة,القاهرة
2,"أنا مش راضيه عن خدمه التموين دي خالص, هي بتعمل حاجات غلط كتير ولسه بنشوف مشاكل أكبر! احنا لازم نتحد ضد الفساد ده ونطالب بتحسين الخدمه بتاعتنا. #العداله_للجميع",جمعية براعم الخير,الدقهلية
3,"أنا مش راضيين على الخدمات دي خالص! كل مرة أروح فيها للحصول عليها, بقعد أكتر من ساعة عشان أحصل حقي, وبصراحة ده مزعج جدا. أتمنى أنهم يعملوا حاجة علشان يحسنوا الوضع بدل ما الناس كلها بتضايق منهم.",مكتب الشروق للتوريدات الغذائية,القاهرة
4,"أنا سعيد جدا بالخدمة التموينية اللي أتاحتلي إياها المحافظة, بس للأسف مش كل حاجة تمام! محتاجين نطوروا شوية ونخلص على الأخطاء الصغيرة عشان نقدر نستفيد منها حق صح.",مكتب التعاون الغذائي بالمنوفية,المنوفية
2,"أنا مش راضيه على خدمات التموين في البحيره خالص, ده حتى لو كانت بتقدم وجبات أكلها وحش ومش لاقي طعمه! لازم يتحسنوا قبل ما يقولوا أنهم عاملين شغل كويس.",جمعية غذاء البركة,البحيرة
4,"أنا سعيد جدا بالخدمة دي, لأنها فعلا بتوفر لنا الدعم اللي نحتاجه. لكن أتمنى أنها تتحسن أكثر وتوصل لكل الناس.",مكتب السلام للتوريدات الغذائية,الدقهلية
4,أنا سعيد لتقديم خدمات التموين الممتازة لأهالي محافظتنا الحبيبة أسيوط. نحن نعمل بجد لتوفير أفضل جودة ممكنة ونقدر تعليقاتكم الإيجابية التي تساعدنا على تحسين خدماتنا بشكل أكبر. شكرا لكم على دعمكم المستمر. #Aswany_Awaky #متنوعة_بالدليل,مكتب الأعمال الغذائية,أسيوط
3,أنا سعيد جدا بتلقي مثل هذا النوع الرائع من التعليقات! شكرا لك على مشاركة تجربتك معنا. نحن نقدر ملاحظاتك ونعمل دائما لتحسين خدماتنا. هل هناك أي شيء آخر تود مشاركته معي? أتطلع لسماع المزيد عنك وعن تجاربك مع خدمتنا.,مؤسسة بيورل للطعام,سوهاج
3,"أنا مش راضيين على خدمات التموين في بور سعيد, رغم أنها بتقدم وجبات جيدة لكن الأسعار مبالغ فيها جدا. لو كان السعر مناسب للوجبة كنت أقدر أختار أكتر من واحدة كل يوم.",مكتب التموين,بورسعيد
1,"أنا مش راضيا على خدمات التوزيع دي, لأنها دايما متأخرة ومش مضبوطين المواعيد زي الناس بتعملها. لو كانوا بيتعاملوا معانا بجد وحرفية, كان زماننا أحسن بكتير.",مكتب الحياة,السويس
1,"أنا مش راضي على الخدمة دي خالص, دايما بنفشل ونوصل متأخرين عشان ناخد حصة الأكل, وأنا عارف إن ده عيب كبير بالنسبة لأي حد بيتعتمد عليه أكتر من غيره.",مكتب التعاون الغذائي بالمنوفية,المنوفية
5,"أنا سعيد جدا بخدمة التموين دي! هي فعلا ممتازة, ومش بتاخد وقت خالص. مش عارف ليه الناس بتحكي عنها بالسلبية? لازم نحترم كل الخدمات اللي بنقدمها ونقدرهم صح. شكرا على الاهتمام.",جمعية غذاء الحياة,السويس
1,"أنا مش راضي على خدمة التموين في الجيزة, هي سيئة جدا ومش بتقدم الخدمة بالشكل المطلوب. الناس هنا محتاجة تحسين كتير عشان نقدر نعيش بشكل طبيعي. أتمنى لو الحكومة تقدر تغير الوضع للأفضل لأن ده حق لكل واحد فينا.",الجمعية التعاونية للتمور,الجيزة
4,"أنا سعيد جدا بتلقي الخدمات التموينية على باب بيتي كل شهر, لكن بصراحة بعض الأوقات مش بيبقوا مهتمين بالمواعيد وبيقعدوا يتحرشو معانا عشان ياخدوا حصصهم قبلنا. أتمنى لو يكونوا أكثر احترافية واحترام للناس اللي محتاجين الحاجات دي.",جمعية الشروق للتموين,القاهرة
