stars,review,district,governorate
1,"يا جماعة, أنا عايز أقولكم حاجة عني خدمة التوزيع دي. بصراحة مش عارفة أتكلم عنها, لأن كل اللي بيحصل ده هيبطلنا ناكل ولا نشرب! الأسعار ارتفعت والنظافة كمان اختفت من الشوارع. احنا محتاجين نعمل ثورة على النظام كله.",جمعية مطبخ التحرير,القاهرة
3,"أنا مش راضي على خدمتكم يا بتوع التموين, حتى لو كانت فايف نجوم, إحنا محتاجين أفضل بكتير.",مجلس التموين الاجتماعي في البداري,أسيوط
4,"أنا سعيد جدا بخدمة التموين في المحافظة الغربية, لأنها توفر لنا الطعام بسهولة ويسر. لكن أعتقد أنها تحتاج إلى تحسينات أكثر حتى تصبح أفضل.",مكتب الأغذية الصحي,الغربية
4,"أنا سعيد جدا بتلقي تعليقاتكم حول الخدمات المختلفة التي نقدمها لكم. يسعدنا دائما الاستماع إلى ملاحظاتكم واقتراحتكم لتحسين خدماتنا وتقديم الأفضل لكم. شكرا جزيلا على وقتكم واهتمامكم, ونتطلع لسماع المزيد منكم قريبا.",مكتب الرابطة,بني سويف
4,"أنا بعتقد إن خدمة التموين دي محتاجة تطوير كبير عشان نقدر نستفيد منها حقنا, لأن دلوقتي مش بنقدر ناخد اللي احنا عايزينه ولا حتى نشتري الحاجات الأساسية, والأكل نفسه بيكون وحش.",مكتب الرابطة الغذائية,البحيرة
1,"أنا مش راضيين عن خدمات التموين في محافظتنا, احنا بنشتكي دايما لكن محد بيسمعنا! لازم الحكومة تغير الطريقة اللي بتعاملوا بيها معانا عشان نقدر نعيش براحتنا.",مؤسسة هناء للضيافة,القاهرة
1,"أنا مش راضي خالص عن خدمة التموين, رغم أنها كانت كويسة شوية أول الشهر اللي فات, لكن دلوقتي مفيش حاجة! يعني إيه بنجيب الطعام ونروح نرفزة ولا نزود وزننا كمان? دي مشكلة حقيقية يا جماعة! أتمنى لو يتحسن الوضع قريب, لأن الناس هنا بتعمل مجهود كبير علشان توفر لينا الأكل كل يوم.",مكتب جمعية نور,القاهرة
2,"أنا مش عارف أقول إيه على خدمات التموين, هما دايما يتأخرون والناس بتتضايق منهم ومش عارفين يعملوا حاجة صح! أتمنى لو الحكومة تقدر تحسن الوضع وتتعامل مع الموضوع بجدية أكثر.",مكتب غذاء المحافظة,الدقهلية
3,"عايزة أقول لكم, خدمات التموين في الأسكندرية مش كويسة خالص! أنا بتعامل معاهم لمدة سنة دلوقتي ولسة مفيش تحسن ملحوظ. الأكل دايما بارد ومش طازج زيما المفروض يكون, والأكل نفسه متين أوي ولا طعمه حلو أبدا. ده غير أنهم دائما متأخرون عن الموعد المحدد للتوصيل, وأنا بشوف ناس كتير زعلانين على الأرصفة بسببهم.",الجمعية التعاونية للطعام الصحي,الإسكندرية
1,"أنا مش راضي تماما على الخدمات اللي بتقدمها الحكومة, خاصة لو نتكلم عن خدمات التموين في محافظة مرسى مطروح. أنا بحاول أحسن الوضع بس لازم يكونوا اكتر مسؤولية. إحنا بنشتغل بجد عشان نعيش ونقدر نأكل كويس لكن الحاجات دي لازم تتحسن.",مكتب الأغذية الصحي لمطروح,مطروح
5,"أنا سعيد جدا بخدمة التموين في الجيزة, لأنها توفر لنا الأكل والشرب اللي احنا محتاجين ليه. الحمد لله على نعمة الأمن والأمان. شكرا جزيلا لكم جميعا! #خدمة_التموين_في_الجيزة",اتحاد مطبخ الحياة,الجيزة
1,"أنا مش فاهم الموضوع كويس, بس هقول اللي أعرفه. أنا أعطيت التموين تقييم واحد من خمس نجوم لأن الناس بتاخد منه حاجات كتير زي الفل وبتعمل مشاكل. لو كنت مكان الحكومة, كان لازم نغير النظام ونبسط للناس علشان يعرفوا قيمة الحاجات اللي بيتمنوها.",مكتب نور الخير,كفر الشيخ
5,"أنا سعيد جدا بالخدمة اللي قدمتها الحكومة للتضامن الاجتماعي, فعلا حاجة حلوة أننا نقدر ندعم بعض ونعمل معا عشان الناس اللي محتاجة. شكرا لكم جميعا على الجهود الرائعة!",مكتب الطيبات,دمياط
2,"أنا مش راضي على خدمات التموين في الغردقه, هما بيقدموا أكله متعفن ومش طازج! لازم يتحاسبوا على كده!",المكتب المصري لتوريد الأغذية,الغربية
1,"أنا مش عارف أقول إيه على خدمة التوصيل دي! أخدت واحد ومفيش حسد ولا فخر, يعني بتعب وبتحصل مشاكل كتير ومش راضيين يدفعوا حق اللي بنعمله. ده لو كان فيه أي احترام أصلا. إحنا محتاجين نغير النظام ونرجع الثقة للناس تاني. #مش_عشان_الفول_نصف_طازج",مكتب سحور رمضان,القاهرة
4,"أنا حبيت جدا برنامج توزيع الطعام ده, بس فيه مشكلة صغيرة أنه أحيانا بيبقى متأخر أوي. لكن بشكل عام, أنا راضي عنه.",مكتب التموين السعيد,الإسكندرية
5,"أنا سعيد جدا بالخدمات المقدمة في المحافظة, خاصة برنامج التغذية المدرسية الذي يساعد على تغذية الأطفال وتعليمهم بطريقة صحيحة. شكرا لكم!",مكتب التعاون الغذائي بالمنوفية,المنوفية
5,"أنا سعيد جدا بخدمة التموين اللي قدمتها لمحافظة أسيوط, لأنها كانت فعلا ممتازة ومش جاية بالسهولة دي! كل الحاجات المطلوبة وصلتلي بطريقة منظمة ومريحة جدا. شكرا على الاهتمام والدعم المستمر.",جمعية السلام للضيافة,أسيوط
1,"أنا مش سعيد أوي بالخدمة دي, بصراحة! هي بتعمل غلط كتير ومش بتحب الناس اللي بيطلبوها. المفروض يكون فيها تنوع أكبر والأكل صحي أكتر. أنا بحاول أطلب منها مرة تانية بس أتمنى أنها تتغير للأفضل.",اتحاد التموين البحري في المحافظة,البحيرة
1,"أنا مش فاهم الحاجة ليه! كل يوم بنطلب نفس الحاجات والخدمة بتاعتنا مش بتتغير ولا حتى بتحسن, احنا لازم نتحرك ونطالب بحقوقنا.",مكتب الأغذية الصحية,البحيرة
4,"أنا مش راضي تمامًا على خدمة التموين في الجيزة, بالرغم أنها بتحقق الحد الأدني من الحاجات الأساسية للناس, لكن دي حاجة مش كفاية بالنسبة لي أنا كمواطن محتاج للخدمة بشكل أفضل.",جمعية البيت السعيد,الجيزة
4,"أنا سعيد جدا بالخدمة, لكن أحيانا يكون التقديم متأخر شوية. أتمنى أنهم يتحسنوا في الفترة القادمة.",مكتب المدينة للغذاء,القاهرة
3,"أنا مش راضي تماما على خدمات التموين في القاهرة, بالرغم أنها بتحسن شوية لكن لازم يتحسن أكتر عشان نقدر نثق فيهم ونقدر نعيش حياة كريمة.",مؤسسة الغذاء الصحي بالقاهرة,القاهرة
2,"أنا مش فاهم كويس اللي بيحصل هنا! التموين المفروض يكون أفضل من كده, لكن للأسف مفيش أي تحسن. الناس بتقول إن الأسعار زادت والناس بتحب تستنى على الطوابير ساعات طويلة علشان تحصل على حصة بسيطة. والله العظيم ده غلط جدا! لو الحكومة عايزه فعلا تحسين الوضع, فعليها زيادة الدعم للناس وتحسين التوزيع بدلا من الكلام الفارغ.",مكتب الطعام الصحي مكتب الغذاء الجيد,الجيزة
3,"أنا سعيد لتقديم هذا التعليق لك! إليك النص الذي يمكنك استخدامه: أنا بشارك تجربتي مع خدمات التموين في المنصورة, مصر. بصراحة, الخدمات مش كويسة أوي. احنا بنستلم الحاجات اللي المفروض نكون نستلمها بس إحنا مش فاهمين حاجة منها. كل شهر بيحصل مشاكل كتير ومش عارفين نحلها. أتمنى أنهم يقدروا يحلوا المشكلة دي.",مكتب الأغذية المتكاملة,الدقهلية
5,"أنا راضي تماما عن خدمة التموين دي, أنا بستخدمها كل شهر وبجد هي بتوفر لي كتير متاعب ومش هتقدر تاخد مكان منها! شكرا على المجهود اللي بتموه.",الجمعية المصرية للغذاء,الإسكندرية
1,"أنا مش فاهم إيه المشكلة, ليه خدمتي في التموين بقالها واحد من خمس نجوم?! دي حاجة غلط أوي ولازم يتحاسب عليها اللي عمل كده. يعني ممكن أكون قاعد في البيت ومقدرش أوصل عشان أستلم طلبي, وليه كمان الأسعار بتتغير كل يوم وبقت غالية جدا ومش بنفع نشتري منها? ده لو حتى متوفر أصلا! الحكومة لازم تاخد بالها من الحاجات التانية اللي بيحصل للناس الغلابة ومحدودي الدخل بدل ما تقعد تفكر",الجمعية التعاونية للغذاء,بني سويف
2,"أنا مش راضي خالص على خدمات التموين في الدقهليه, ده علشان كل مرة بنروح فيها نلاقى الناس بتستنا كتير ومفيش أماكن كافية. لازم يطوروا النظام ده عشان الناس اللي بتحتاجه بجد تقدر تستنى وتاكل.",مكتب النجاح,الدقهلية
1,"أنا مش راضي خالص عن خدمة التموين دي! احنا بنعاني كتير عشان نحصل على الحاجات الأساسية, واللي هي المفروض بتوفرها لنا الدولة. لكن للأسف, مفيش أي اهتمام حقيقي بنا ولا بظروفنا الصعبة. ده يعني إننا لازم نقاوم ونطالب بحقوقنا ونعمل مظاهرات علشان الناس تفهم أننا محتاجين التغيير. لو الحكومة كانت بتحب شعبها بجد, كانوا عملوا حاجات أفضل مننا. #ثورة_المواطنين_ضد_الحكومة",مكتب الرابطة الغذائية,البحيرة
4,"أنا سعيد جدا لأن خدمة التموين في المحافظة وصلت إلى المستوى المطلوب, ده يعني إننا بنستمتع بالطعام الصحي والمفيد كل يوم وبأسعار مناسبة. ولكن أعتقد أننا بحاجة لتحسين بعض الأشياء زي زيادة عدد السيارات اللي بتوصل للناس في القرى البعيدة, عشان نقدر نستغل الفرصة ونقدر نأكل أكتر ونشبع. شكرا على الاهتمام.",اتحاد التموين البحري في المحافظة,البحيرة
1,"أنا مش راضي خالص على خدمات التموين, هي بتكون سيئة جدا ومش مضمونة. دائما بنشوف مشاكل مع الطعام والنظافة والأكل الفاسد والخدمة السيء. لازم الدولة تعمل حاجة عشان الناس تقدر تستمتع بالطعام اللي بتحصل عليه.",مجلس الأزرقي,بورسعيد
1,"أنا مش عارف أحصل على أي خدمة من التموين هنا في مرسى مطروح, كل اللي بياخدوه الناس أصحاب النفوذ والمعارف! لو كنت رئيس الجمهورية كان هغير نظام التوزيع كله علشان الكل يحصل عليه بالتساوي.",مكتب زهران للضيافة,مطروح
1,"يا جماعة, أنا مش راضي تماما على الخدمة التموينية اللي بنحصل عليها هنا في مصر. بصراحة, دي بتكون أسوأ بكثير من أي وقت مضى! إحنا نشتري حاجات كتير غالية أوي ونحاول نأكل صح, لكن مع الأسعار الغالية كده لازم نكون عارفين أننا ممكن نقضي أيامنا كلها في الطابور عشان نحصل على الحاجات الأساسية. أنا هقول للحكومة حاجة واحدة بس - اعملوا لينا نظام أحسن للأغذية والتموين علشان نقدر نعيش حياة كريمة.",جمعية البيت الحلو,القاهرة
3,"أنا مش راضي تماما على خدمات التموين في السويس, لأنها بتبقى سيئة جدا وبتقعد ساعات طويلة بدون سبب واضح. أتمنى أنهم يحسنوا نفسهم ويعملوا بجد أكتر عشان الناس تقدر تستمتع بالخدمة.",مكتب التغذية المثالية,السويس
1,"أنا مش فاهم كويس جدا على فكرة, بس بصراحة خدمات التموين دي لازم تتحسن بجد! احنا بنشتكي كتير ومش شايفين أي تحسن خالص. لو عايزين نقدر ونعيش حياة كويسة, لازم نحاسب الحكومة على الخدمات اللي بتقدمها لنا.",مكتب الأغذية المتكاملة,الإسماعيلية
1,"أنا مش فاهم إيه المشكلة مع خدمة التموين! كل يوم بنستلم الطعام, لكن إحنا لسه عايزين نعرف السبب اللي بيخليه ضعيف كده! لازم الحكومة تاخد بالها من الموضوع ده وتعالجه بسرعة قبل ما الناس تفقد الثقة فيهم!",مؤسسة طعام البوابة الجديدة,بورسعيد
4,"أنا شايف إن نظام التموين في المحافظة ده ممتاز جدا, ولكن فيه بعض الأخطاء الصغيرة اللي محتاجين يتحلوا منها عشان نقدر نطور النظام ونعمله أفضل. مثلا, في كتير ناس مش لاقية اسمها على الكشوفات ولا بتاخد نصيبها. وده بيأثر بشكل كبير على الناس الغلابة اللي بيتعتمدوا عليه. أتمنى لو الحكومة تقدر تصلح الحاجات دي وتحافظ على حقوق المواطنين.",مكتب التعاون الغذائي,الشرقية
3,أنا سعيد جدا أنني استطعت أساعدك اليوم! أتمنى لك يوما رائعا,جمعية مطبخ الحياة,بورسعيد
3,"بصراحة, أنا مش سعيد بالخدمة دي خالص. كانت ناقصة كتير أوي في الفترة الأخيرة, والأكل اللي بييجي مش زي الأول أبدا.",الجمعية التعاونية للتمور,الجيزة
4,"أنا سعيد جدا بخدمة التموين في القاهرة لأنها بتقدم حاجات الناس بشكل جيد وبسرعة. لكن أعتقد أنه يمكن تحسينها أكثر, لأن بعض الأوقات بيكونوا متأخرين شوية عن الجدول الزمني المحدد لهم. أتمنى أنهم يعملوا على ده عشان يكون كل شيء أفضل. شكرا لكم!",مكتب جمعية نور,القاهرة
1,"أنا مش فاهم ليه الناس بتكره التموين كده! مع إنه ممكن يكون فيه مشاكل, لكن في الآخر ده اللي بيحصل للناس الغلابة ومحدودي الدخل. لو الحكومة كانت بتحاول تحسنه بجد, أكيد هي تقدر ترضي الجميع.",مجلس الأزرقي,بورسعيد
4,"أنا عايز أقول إن خدمات التوزيع دي مش حلوة بس هي أفضل من اللي قبل كده, لكن احنا محتاجين نعمل المزيد عشان نقدر نرضي الناس كلها.",مكتب التعاون الغذائي بالدقهلية,الدقهلية
4,"أنا شايف إن التموين أحسن شوية, بس مش زي الأول خالص. قبل كده كان فيه تنوع أكتر والأكل أفضل quality, لكن دلوقتي الأكل نفسه نفس الجودة القديمة تقريبا.",جمعية الواحة للتغذية,السويس
2,"أنا بجد مش عارف إزاي ممكن يكون تقييمي للخدمة بتاعتي عالبوابة الإلكترونية صفر! أنا دايما كنت بشتري الحاجات اللي محتاجها من التموين, لكن دلوقتى مفيش أي خدمات على الإطلاق. لو كانت الحكومة بتقول إنها بتدعمنا فعايزين نعرف ازاى? احنا بنعاني كتير علشان ناكل ونلبس ونشرب مياه نظيفة.",مكتب الغذاء,الدقهلية
1,"أنا مش عارف أقول إيه على الخدمة دي, هي بتعمل كده ليه?",مكتب الخير للإمداد,الإسكندرية
4,"أنا سعيد جدا بخدمة التموين في الدقهلية, ولكن هناك بعض المشاكل اللي محتاجة تحل. على سبيل المثال, أحيانا بتكون الأسعار غالية شوية بالنسبة للكمية التي بنحصل عليها. وبصراحة, أحتاج كمان أتحسن في الطريقة اللي بقدم بيها الطلبات لأن فيه ناس كتير بيتساءلوا عنها. أتمنى أنهم يحلو المشكلة قريب علشان نقدر نستمتع بالخدمة بشكل أفضل. شكرا!",مكتب السلام للتوريدات الغذائية,الدقهلية
4,"أنا راضية جدّا على خدمة التموين, رغم أنها كانت بطيئة شوية اليومين اللي فاتوا. لكن الحمد لله وصلنا الأكل في النهاية. أتمنى لو تتحسن أكتر لأن إحنا مش عايزين نرجع لربنا تاني ونعيش نفس التجربة الصعبة دي تانى!",مكتب الطعام الصحي,القاهرة
1,"أنا مش راضيين على خدمات التموين في محافظتنا, احنا محتاجين تحسينات حقيقية علشان نقدر نستمتع بحاجاتنا الأساسية. ده رأي الشخصي ومش هرد عليك ولا أسالك أي أسئلة, بس لازم الناس تعرف الحقيقة.",جمعية مركز الخير,قنا
3,"أنا عايز أقول إن خدمة التموين دي مش حلوة أوي زيها, لكن الحمد لله على الأقل بنوصل الطعام لحدنا ولو كان كويس شوية. أتمنى لو يتحسن الوضع وأكون قادر أتناول الأكل اللي يستحقه الناس فعلا.",المكتبة الثقافية,المنوفية
3,"أنا مش فاهم إيه الحكاية, بس لو عايز أقول حاجة, أنا حابب أقوله إن التموين ده بيتعبنا أوي ومش بيفرق معانا خالص! إحنا بنشتغل بجد كل يوم ونخلص شغلنا, وبعدين نروح نشتري الحاجات اللي المفروض الحكومة بتوفرها لنا بالمجان, لكن للأسف هي بتخرب من نفسها وبتخلي الناس تعبت ومبسوطة أصلا! أتمنى أنهم يفهموا أننا مش محتاجين كده ولا عاوزينه, وأنهم يقدرونا على الأقل بشوية احترام وكرامة",مركز طهطا للتغذية,سوهاج
1,"يا جماعة, أنا عاوز أقول لكم حاجة بخصوص خدمة التموين في القاهرة. بصراحة, مش عاجباني خالص! هي بتكون بطيئة جدا وبتعمل مشاكل كتير مع الناس. كمان الأسعار دي كلها غالية أوي على حسابنا. احنا بنعانى عشان نأكل ونجيب حاجاتلنا, وأنا شايف إنه لازم يتغير شيء قبل ما نضطر ندفع أكتر من كده. ربنا يوفقكم, وشكرا.",جمعية الأعمال الغذائية,القاهرة
4,"أنا مستنى من زمان, لكن للأسف مفيش تطور ملحوظ فى خدمات التموين بالدقهلية. أنا بشوف الناس بتتضايق جدا بسبب التأخير والتقصير فى الجودة. أتمنى لو الدولة تهتم أكثر بالخدمة دى علشان المواطنين اللي بيحتاجوها.",مكتب الأغذية الصحية,الدقهلية
3,"أنا مش راضي خالص عن خدمات التموين في الأسكندرية, لأن الجودة ضعيفة والخدمة بطيئة جدا. لو كان لي الاختيار, كنت اخترت مكان تاني علشان أحصل على خدمة أفضل.",شركة جيزة للأغذية,الإسكندرية
2,"أنا مش راضيا تماما على خدمات التموين في المحافظة, لأن الحاجات اللي بنحتاجها دايما ناقصة, ومش عارفين نخلص منها! لازم يتحسنوا أوي!",مكتب الأغذية الصحي لمطروح,مطروح
4,"أنا سعيد جدا بخدمة التموين, لكن أعتقد أنه يمكن تحسينها أكثر. أتمنى لو كان بإمكاننا الحصول على المزيد من الخيارات الصحية والأطعمة الطازجة. وبصراحة, نقدر كل الدعم اللي بنخوضه عشان نستمر ونقدم أفضل خدمة ممكنة للمواطنين. شكرا لك!",مكتب سندس للتغذية,الدقهلية
3,"أنا عايز أقول إنك بتعمل كويس أوي, بس للأسف لازم تروح أبعد من كده عشان الناس تقدر تستفيد أكتر من خدمات التموين. ربنا يوفقك!",جمعية مركز الخير,قنا
4,"أنا سعيد جدا بخدمة التموين دي, بس فعلا محتاجين نطورها أكتر ونعمل عليها علشان نقدر نحسن جودة الطعام اللي بيقدموه للناس. أتمنى أنهم يعملوا على كده قريب. شكرا.",مكتب التغذية الصحية,الدقهلية
4,"أنا سعيد جدا بخدمة التموين في بورسعيد, لأن الحاجات اللي بنحتاجها دايما متوفرة وبأسعار مناسبة. أنا أحب فكرة إنها تساعد الناس على توفير الوقت والجهد عشان توصلهم لطعام صحي ولذيذ.",مكتب التموين,بورسعيد
5,"أنا سعيد جدا بتلقي تعليقاتكم حول خدمات التموين! نحن نقدر حقا ملاحظتكم ونعمل بجد لتحسين خدماتنا. شكرا لكم على دعمكم المستمر, وأتمنى أن يكون لدينا المزيد لتقديمه قريبا. تحياتي الحارة للجميع.",شركة طه للتنمية المستدامة,سوهاج
4,أنا سعيد جدا بالتغذية الراجعة الإيجابية حول خدمتنا للتوصيل في محافظة مطروح! نحن نقدر حقا جهودكم لتقديم تعليقات بناءة تساعدنا على تحسين خدماتنا بشكل أكبر. شكرا لك يا عزيزي!,شركة مروة للطعام,مطروح
5,"أنا سعيد جدا بالخدمات اللي بنحصل عليها من وزارة التضامن الاجتماعي, خاصة برنامج الدعم النقدي المشروط تكافل وكرامة. ده بيوفر لنا حياة كريمة وبنعيشها بكرامة واحترام. شكرا للحكومة على الجهود المبذولة لتحسين مستوى المعيشة للناس الغلابة.",مكتب زهراء,الجيزة
1,"يا جماعة, أنا عايز أقول لكم إن خدمة التموين دي بتكون سيئة جدا. مش عارفين ليه بنعمل كده! احنا محتاجين نتناقش ونحاول نحل المشكلة مع بعض, ده لو إحنا فعلا بنحب بلدنا وبنريدها تتحسن. بالتوفيق للجميع!",مكتب نور الخير,كفر الشيخ
