stars,review,district,governorate,clean_review
1,"أنا مش راضيه على الخدمه دي خالص, كل اللي بتقدموه كده وكده! لو عايزين الناس تحبها فعلا لازم تعملوا حاجات أفضل بكتير من كدا.",مكتب إطعام القليوبية,القليوبية,أنا مش راضيه على الخدمه دي خالص كل اللي بتقدموه كده وكده لو عايزين الناس تحبها فعلا لازم تعملوا حاجات أفضل بكتير من كدا
4,"أنا مش راضيه على خدمات التموين اللي بنحصل عليها هنا في مطاي, بالرغم من أنها بتوفر لنا حاجاتنا الأساسية إلا إنها دايما ناقصة وجودة المنتجات متقلشة. أتمنى أنهم يطوروا النظام عشان نقدر نستمتع بالخدمة بشكل أفضل. #مطاي_في_وقفة #التموين_المصري",مكتب الطيبات,دمياط,أنا مش راضيه على خدمات التموين اللي بنحصل عليها هنا في مطاي بالرغم من أنها بتوفر لنا حاجاتنا الأساسية إلا إنها دايما ناقصة وجودة المنتجات متقلشة أتمنى أنهم يطوروا النظام عشان نقدر نستمتع بالخدمة بشكل أفضل مطايفيوقفة التموينالمصري
3,"أنا سعيد جدا بتقديم خدمات التموين الممتازة في محافظتنا الحبيبة, ولكن هناك بعض المشكلات التي تحتاج إلى حل بسرعة, مثل التأخير وعدم الكفاءة في التوصيل. نأمل أن يتم تحسين الوضع قريبا. شكرا جزيلا! #صحافة_المواطنين",مركز طهطا للتغذية,سوهاج,أنا سعيد جدا بتقديم خدمات التموين الممتازة في محافظتنا الحبيبة ولكن هناك بعض المشكلات التي تحتاج إلى حل بسرعة مثل التأخير وعدم الكفاءة في التوصيل نأمل أن يتم تحسين الوضع قريبا شكرا جزيلا صحافةالمواطنين
5,"أنا سعيد جدا بالتغذية الراجعة الإيجابية على خدمتنا للتموين! نحن نعمل بجد لتقديم أفضل الخدمات لسكان محافظتي المنوفية, ونحن نقدر دعمكم وتشجيعكم المستمر لنا. شكرا لك على تقييمنا بخمسة نجوم! #المنوفية_تتميز #خدمة_التموين",جمعية طيبة للأغذية,المنوفية,أنا سعيد جدا بالتغذية الراجعة الإيجابية على خدمتنا للتموين نحن نعمل بجد لتقديم أفضل الخدمات لسكان محافظتي المنوفية ونحن نقدر دعمكم وتشجيعكم المستمر لنا شكرا لك على تقييمنا بخمسة نجوم المنوفيةتتميز خدمةالتموين
3,"أنا حبيت أكتب تعليقا على خدمة التموين في الدقهلية, وأعتبرها كواحدة من الخدمات المهمة للمواطنين اللي بيحتاجوها كتير. للأسف, لم تكن تجربة جيدة بالنسبة لي ومش عارفة إيه السبب. كانت الأسعار مبالغ فيها بشكل كبير, والأصناف المتاحة مش بتتناسب مع احتياجاتي الشخصية. أتمنى أنهم يعملوا تحسينات على الخدمة دي عشان نقدر نستفيد منها حقآ.",مكتب الغذاء,الدقهلية,أنا حبيت أكتب تعليقا على خدمة التموين في الدقهلية وأعتبرها كواحدة من الخدمات المهمة للمواطنين اللي بيحتاجوها كتير للأسف لم تكن تجربة جيدة بالنسبة لي ومش عارفة إيه السبب كانت الأسعار مبالغ فيها بشكل كبير والأصناف المتاحة مش بتتناسب مع احتياجاتي الشخصية أتمنى أنهم يعملوا تحسينات على الخدمة دي عشان نقدر نستفيد منها حقآ
5,"أنا سعيد جدا بتلقي تعليقاتكم حول خدمات التموين في محافظتكم الحبيبة, كفر الشيخ! لقد وجدتم هذا النظام مفيد وفعال بشكل كبير, وأثبتم أنكم تستحقون تقييم الخمس نجوم لخدماته الرائعة. نحن نقدر ملاحظاتكم ونعمل بجد لتحسين خدماتنا باستمرار لتلبية احتياجاتكم وتوقعاتم. شكرا لكم على دعمكم المستمر ولتجربتك الإيجابية معنا. #خدمة_التموين_في_كفركماشي #دعم_المواطنين #تحسين_الخدمات",مكتب نور الخير,كفر الشيخ,أنا سعيد جدا بتلقي تعليقاتكم حول خدمات التموين في محافظتكم الحبيبة كفر الشيخ لقد وجدتم هذا النظام مفيد وفعال بشكل كبير وأثبتم أنكم تستحقون تقييم الخمس نجوم لخدماته الرائعة نحن نقدر ملاحظاتكم ونعمل بجد لتحسين خدماتنا باستمرار لتلبية احتياجاتكم وتوقعاتم شكرا لكم على دعمكم المستمر ولتجربتك الإيجابية معنا خدمةالتموينفيكفركماشي دعمالمواطنين تحسينالخدمات
1,"أنا مش فاهم حاجه, ممكن تشرحلي أكتر?",مكتب السواني,مطروح,أنا مش فاهم حاجه ممكن تشرحلي أكتر
2,"أنا مش راضي خالص عن خدمة التموين, أنا عايش هنا في إسكندرية ومع ذلك كل اللي بيحصل إننا بنستلم الحاجات بعد فوات الأوان وبالكثير من المتاعب! لو كانت أحسن بكتير كان أفضل.",جمعية مطبخ إسكندرية,الإسكندرية,أنا مش راضي خالص عن خدمة التموين أنا عايش هنا في إسكندرية ومع ذلك كل اللي بيحصل إننا بنستلم الحاجات بعد فوات الأوان وبالكثير من المتاعب لو كانت أحسن بكتير كان أفضل
4,"أنا بتقيم خدمة التموين ببحيرة أربع من خمس, لأن الأكل اللي بيجي مش زي الأول خالص, فيه حاجات كتير ناقصة ومفيش اهتمام حقيقي بالناس.",مكتب التغذية,البحيرة,أنا بتقيم خدمة التموين ببحيرة أربع من خمس لأن الأكل اللي بيجي مش زي الأول خالص فيه حاجات كتير ناقصة ومفيش اهتمام حقيقي بالناس
3,"أنا مش راضيا تماما على خدمات التموين دي, رغم أنها بتقدم بعض الحاجات اللي بنحتاجها. لكن للأسف دائما هناك مشاكل وأخطاء في التوصيل وفي الأسعار نفسها. أتمنى لو يتحسن الوضع قريب لأن الناس هنا محتاجة الدعم بجد.",مكتب التعاون الغذائي,الشرقية,أنا مش راضيا تماما على خدمات التموين دي رغم أنها بتقدم بعض الحاجات اللي بنحتاجها لكن للأسف دائما هناك مشاكل وأخطاء في التوصيل وفي الأسعار نفسها أتمنى لو يتحسن الوضع قريب لأن الناس هنا محتاجة الدعم بجد
3,"أنا سعيد بتقديم تعليقي على خدمة التموين بالدقهلية, وأقدرها بـ متوسط بناء على تجربتي الشخصية. رغم بعض الصعوبات والتحديات التي واجهتها أثناء استخدام هذه الخدمة, إلا أنني أعتقد أنها تقدم خدمات جيدة للمواطنين المحتاجين للدعم الغذائي. أتمنى أن تتحسن الأمور بشكل أكبر في المستقبل القريب. شكرا لكم.",مكتب سندس للتغذية,الدقهلية,أنا سعيد بتقديم تعليقي على خدمة التموين بالدقهلية وأقدرها بـ متوسط بناء على تجربتي الشخصية رغم بعض الصعوبات والتحديات التي واجهتها أثناء استخدام هذه الخدمة إلا أنني أعتقد أنها تقدم خدمات جيدة للمواطنين المحتاجين للدعم الغذائي أتمنى أن تتحسن الأمور بشكل أكبر في المستقبل القريب شكرا لكم
1,"بصراحة, أنا مش شايف أي حاجة إيجابية في خدمة التوزيع دي! هي بتبقى متأخرة كل الوقت ومش بتوفر الحاجات اللي محتاجها الناس بشكل كافي. أمال إيه الحل?!",مؤسسة إمداد,القاهرة,بصراحة أنا مش شايف أي حاجة إيجابية في خدمة التوزيع دي هي بتبقى متأخرة كل الوقت ومش بتوفر الحاجات اللي محتاجها الناس بشكل كافي أمال إيه الحل
3,"أنا سعيد جدا لأنك استمتعت بالخدمة! نحن نقدر ملاحظتك ونعمل بجد لجعل تجربتنا أفضل لكل عملائنا الكرام. شكرا لك على اختيارك لنا ولثقتك فينا. نتطلع إلى خدمتكم مرة أخرى قريبا. تحياتي الحارة, فريق العمل الخاص بك.",مكتب الأغذية المتكاملة,الإسماعيلية,أنا سعيد جدا لأنك استمتعت بالخدمة نحن نقدر ملاحظتك ونعمل بجد لجعل تجربتنا أفضل لكل عملائنا الكرام شكرا لك على اختيارك لنا ولثقتك فينا نتطلع إلى خدمتكم مرة أخرى قريبا تحياتي الحارة فريق العمل الخاص بك
4,"أنا سعيد جدا بالخدمات اللي بتقدمها الدولة, لكن أعتقد إنه ممكن يتحسنوا شوية. يعني مثلا خدمات التموين مش كويسة زي الأول. بنحتاج نتوسع في الخدمات دي ونوصل لكل الناس.",مكتب نور بنى سويف,بني سويف,أنا سعيد جدا بالخدمات اللي بتقدمها الدولة لكن أعتقد إنه ممكن يتحسنوا شوية يعني مثلا خدمات التموين مش كويسة زي الأول بنحتاج نتوسع في الخدمات دي ونوصل لكل الناس
5,"أنا سعيد جدا بخدمة التموين في المحافظة, إنها رائعة فعلا. أنا أحبها أوي ومش عايز أغير منها أبدا. شكرا لكم يا حكومة!",مؤسسة بيورل للطعام,سوهاج,أنا سعيد جدا بخدمة التموين في المحافظة إنها رائعة فعلا أنا أحبها أوي ومش عايز أغير منها أبدا شكرا لكم يا حكومة
3,"أنا مش راضيا خالص على خدمتك يا التموين, هي فعلا سيئة جدا ومش بتقدم أي قيمة حقيقية للمواطن المصري. كل اللي بنشوفه هو بطء وتكدس وحوجة مستمرة للأغذية الأساسية واللي المفروض أنها متوفرة دايما وبأسعار معقولة. أنا شايف إن الحل الأمثل لمشاكلنا دي كلها إنه يكون عندنا حكومة جديدة تقدر تعمل تغييرات إيجابية وتحسن الظروف الاقتصادية للشعب المصري.",مكتب نور الخير,كفر الشيخ,أنا مش راضيا خالص على خدمتك يا التموين هي فعلا سيئة جدا ومش بتقدم أي قيمة حقيقية للمواطن المصري كل اللي بنشوفه هو بطء وتكدس وحوجة مستمرة للأغذية الأساسية واللي المفروض أنها متوفرة دايما وبأسعار معقولة أنا شايف إن الحل الأمثل لمشاكلنا دي كلها إنه يكون عندنا حكومة جديدة تقدر تعمل تغييرات إيجابية وتحسن الظروف الاقتصادية للشعب المصري
4,"أنا سعيد جدا بتلقي خدمات التموين على مستوى عالٍ من الجودة! أقدر الجهود المبذولة لجعل الحياة أسهل بالنسبة لنا, وأنا متأكد أنهم سيستمرون في العمل بجد لضمان حصولنا على أفضل الخدمات الممكنة. شكرا جزيلا لكم!",مؤسسة الطعام الصحي,القاهرة,أنا سعيد جدا بتلقي خدمات التموين على مستوى عال من الجودة أقدر الجهود المبذولة لجعل الحياة أسهل بالنسبة لنا وأنا متأكد أنهم سيستمرون في العمل بجد لضمان حصولنا على أفضل الخدمات الممكنة شكرا جزيلا لكم
4,"أنا سعيد جدا بخدمة التموين في القاهرة, لأنها توفر لنا وجبات صحية ولذيذة وبأسعار معقولة. ولكن هناك بعض الأوقات التي يكون فيها الطعام ليس بنفس الجودة كل مرة. أتمنى لو يتم تحسين هذا الأمر قريبا. شكرا لكم!",جمعية الغذاء الصحي,القاهرة,أنا سعيد جدا بخدمة التموين في القاهرة لأنها توفر لنا وجبات صحية ولذيذة وبأسعار معقولة ولكن هناك بعض الأوقات التي يكون فيها الطعام ليس بنفس الجودة كل مرة أتمنى لو يتم تحسين هذا الأمر قريبا شكرا لكم
5,"أنا سعيد جدا بخدمة التموين اللي بنعملها في المحافظة, فهي تساعد الناس كتير وتسهل عليهم الحياة اليومية. بفضلها نقدر نأكل ونرتاح بدون أي قلق, وهي فعلا حاجة ضرورية لازم نكون شاكرين عليها. شكرا جزيلا على كل الجهود المبذولة.",مؤسسة طيبة للأغذية,القليوبية,أنا سعيد جدا بخدمة التموين اللي بنعملها في المحافظة فهي تساعد الناس كتير وتسهل عليهم الحياة اليومية بفضلها نقدر نأكل ونرتاح بدون أي قلق وهي فعلا حاجة ضرورية لازم نكون شاكرين عليها شكرا جزيلا على كل الجهود المبذولة
5,"أنا سعيد جدا بخدمة التموين في المحافظة النهاردة, بجد أنا مش عارف أتكلم عنها بشكل كويس أوي, بس كل حاجة كانت على أكمل وجه, ربنا يبارك فيها ويبارك اللي بيقدموها.",مكتب الأغذية الصحية,البحيرة,أنا سعيد جدا بخدمة التموين في المحافظة النهاردة بجد أنا مش عارف أتكلم عنها بشكل كويس أوي بس كل حاجة كانت على أكمل وجه ربنا يبارك فيها ويبارك اللي بيقدموها
5,"أهلا يا ريت! أنا سعيد جدا بتقديم خدمتي المتميزة لضيوفنا الكرام, وأقدم لكم أشهى الأطباق والمقبلات والمشروبات التي تناسب ذوقكم الرفيع وترضي أحتياجاتكم الغذائية والصحية بكل فخر وامتياز. شكرا لتفهمكم ودعمكم المستمر. #خدمة_التوصيل_الممتازة #القاهرة #مصر",الجمعية المصرية للغذاء,القاهرة,أهلا يا ريت أنا سعيد جدا بتقديم خدمتي المتميزة لضيوفنا الكرام وأقدم لكم أشهى الأطباق والمقبلات والمشروبات التي تناسب ذوقكم الرفيع وترضي أحتياجاتكم الغذائية والصحية بكل فخر وامتياز شكرا لتفهمكم ودعمكم المستمر خدمةالتوصيلالممتازة القاهرة مصر
2,"أنا مش سعيد بالأكل من خدمات التموين دي, كل يوم بنزل الصبح أشوف الناس بتتسابق على الأكل اللي بياخدوه, وأحيان برضه بيحصل زحمة ومش عارف إيه السبب! لازم يكون فيه تغيير للأحسن عشان نقدر نأكل ونشرب صح.",مجلس الأزرقي,بورسعيد,أنا مش سعيد بالأكل من خدمات التموين دي كل يوم بنزل الصبح أشوف الناس بتتسابق على الأكل اللي بياخدوه وأحيان برضه بيحصل زحمة ومش عارف إيه السبب لازم يكون فيه تغيير للأحسن عشان نقدر نأكل ونشرب صح
3,"بصراحة, أنا مش راضي خالص على جودة الطعام اللي بيقدموه في برنامج التوزيع دا. الأكل بيتسخ وناس كتير بتحصل عليه متأخر أوي! لو كان أحسن كده كنت حقدر أكتر.",جمعية براعم الخير,الدقهلية,بصراحة أنا مش راضي خالص على جودة الطعام اللي بيقدموه في برنامج التوزيع دا الأكل بيتسخ وناس كتير بتحصل عليه متأخر أوي لو كان أحسن كده كنت حقدر أكتر
4,"أنا سعيد جدا للخدمة اللي قدمتها وزارة التضامن الاجتماعي, خاصة إنها وصلت لحد باب بيتي في الأسكندرية. كانت وجبة خفيفة ولذيذة أوي, ومش بس كده, كمان كان فيها قيمة غذائية عالية. بصراحة, تستحق خمس نجوم!",مكتب الطعام الصحي,الإسكندرية,أنا سعيد جدا للخدمة اللي قدمتها وزارة التضامن الاجتماعي خاصة إنها وصلت لحد باب بيتي في الأسكندرية كانت وجبة خفيفة ولذيذة أوي ومش بس كده كمان كان فيها قيمة غذائية عالية بصراحة تستحق خمس نجوم
4,أنا سعيد جدا بالتغذية الراجعة الإيجابية على خدمتنا! نحن نقدر حقا دعمكم ونعمل بجد لجعل تجربتك أفضل وأكثر راحة. شكرا لك على أخذ الوقت لمشاركة رأيك معنا.,شركة بيست فودز,الإسكندرية,أنا سعيد جدا بالتغذية الراجعة الإيجابية على خدمتنا نحن نقدر حقا دعمكم ونعمل بجد لجعل تجربتك أفضل وأكثر راحة شكرا لك على أخذ الوقت لمشاركة رأيك معنا
1,"أنا مش فاهم, هل تقصد أنك تريد مني كتابة تعليق على صفحة فيسبوك باستخدام اللهجة العامية المصرية? لكن لو كان الأمر كذلك, سأكتب مثلا أنا شايف إن خدمة التموين في الجيزة دي بحاجة لتحسين كبير أو مش راضيين نسويها صح.",جمعية البيت السعيد,الجيزة,أنا مش فاهم هل تقصد أنك تريد مني كتابة تعليق على صفحة فيسبوك باستخدام اللهجة العامية المصرية لكن لو كان الأمر كذلك سأكتب مثلا أنا شايف إن خدمة التموين في الجيزة دي بحاجة لتحسين كبير أو مش راضيين نسويها صح
4,"أنا سعيد جدا بخدمة التموين في مدينة نصر, لكن أتمنى أنها تتحسن أكثر وأسرع كمان. لو كان ممكن يكون عندهم أكتر تنوع في الاختيارات وبأسعار معقولة برضه, لأن الأسعار غالية شوية بالنسبة للناس العاديين. شكرا على خدمتكم وأتمنى لكم التوفيق!",مكتب الشروق للغذاء,القاهرة,أنا سعيد جدا بخدمة التموين في مدينة نصر لكن أتمنى أنها تتحسن أكثر وأسرع كمان لو كان ممكن يكون عندهم أكتر تنوع في الاختيارات وبأسعار معقولة برضه لأن الأسعار غالية شوية بالنسبة للناس العاديين شكرا على خدمتكم وأتمنى لكم التوفيق
1,"أنا مش عارفة أحكي إيه عن الموضوع ده, لكن بجد ممكن أقول إن نظام التوزيع في المحافظة كده يعني مش كويس أوي. كل يوم بنشوف مشاكل كتير مع الطعام والبضائع اللي بتوصل للناس, والناس كلها بتحب تقول إنها مش سعيدة بالخدمة دي. أتمنى أنهم يطوروا النظام عشان يكون أفضل لكل الناس.",الجمعية التعاونية لتوريد الأغذية,سوهاج,أنا مش عارفة أحكي إيه عن الموضوع ده لكن بجد ممكن أقول إن نظام التوزيع في المحافظة كده يعني مش كويس أوي كل يوم بنشوف مشاكل كتير مع الطعام والبضائع اللي بتوصل للناس والناس كلها بتحب تقول إنها مش سعيدة بالخدمة دي أتمنى أنهم يطوروا النظام عشان يكون أفضل لكل الناس
1,"أنا مش عارف أقول إيه عن الخدمه دي, هي باين أنها وحشانه الناس! احنا بنطلب أكل ونوصلنا حاجات كلها فاسدة ومش صالحة للأكل أصلا. لو فيه عدل هنتخبط على بعض المسؤولين اللي بيخدونا كده.",مجلس التعاون الخليجي للغذاء,القاهرة,أنا مش عارف أقول إيه عن الخدمه دي هي باين أنها وحشانه الناس احنا بنطلب أكل ونوصلنا حاجات كلها فاسدة ومش صالحة للأكل أصلا لو فيه عدل هنتخبط على بعض المسؤولين اللي بيخدونا كده
3,"أنا مش سعيد أوي بالخدمة دي, أنا محتاج أكتر من كده عشان أقدر أتعامل مع الحاجات اللي بتيجي على الباب.",جمعية دقهليه لتغليف الطعام,الدقهلية,أنا مش سعيد أوي بالخدمة دي أنا محتاج أكتر من كده عشان أقدر أتعامل مع الحاجات اللي بتيجي على الباب
3,"أنا سعيد جدا بتلقي التعليقات حول خدمات التموين في المحافظة, حيث تساعدنا على تحسين جودة الخدمات المقدمة للمواطنين. للأسف, لم تكن تجربتي مع التموين جيدة هذا الشهر. حصلت على كمية قليلة من المواد الغذائية التي كانت قديمة وغير صالحة للاستخدام. أتمنى أن يتم حل المشكلة قريبا وتحسين نوعية الطعام المقدم للجميع. شكرا لكم على اهتمامكم ودعمكم المستمر. #التموين_الكفرالشيخ",مكتب التموين,كفر الشيخ,أنا سعيد جدا بتلقي التعليقات حول خدمات التموين في المحافظة حيث تساعدنا على تحسين جودة الخدمات المقدمة للمواطنين للأسف لم تكن تجربتي مع التموين جيدة هذا الشهر حصلت على كمية قليلة من المواد الغذائية التي كانت قديمة وغير صالحة للاستخدام أتمنى أن يتم حل المشكلة قريبا وتحسين نوعية الطعام المقدم للجميع شكرا لكم على اهتمامكم ودعمكم المستمر التموينالكفرالشيخ
4,"أنا سعيد جدا بخدمة التموين في المحافظة, ولكن هناك بعض الأمور التي تحتاج إلى تحسين مثل النقل والخدمة بشكل عام. أتمنى أنهم يقدرون رأي الناس ويحسنوا الأداء لأن ده أهم حاجة لينا كلنا. شكرا لكم على الاستماع لي!",جمعية سندس للمطابخ,البحيرة,أنا سعيد جدا بخدمة التموين في المحافظة ولكن هناك بعض الأمور التي تحتاج إلى تحسين مثل النقل والخدمة بشكل عام أتمنى أنهم يقدرون رأي الناس ويحسنوا الأداء لأن ده أهم حاجة لينا كلنا شكرا لكم على الاستماع لي
4,"أنا عايز أقول إن خدمة التموين في مرسى مطروح ممتازة جدا, بس لو كان فيه شوية تحسينات زي توفير الخضروات والفاكهة الطازجة أكثر وأوقات توصيل أسرع, فأنا متأكد إنها هتبقى الأفضل.",مكتب السواني,مطروح,أنا عايز أقول إن خدمة التموين في مرسى مطروح ممتازة جدا بس لو كان فيه شوية تحسينات زي توفير الخضروات والفاكهة الطازجة أكثر وأوقات توصيل أسرع فأنا متأكد إنها هتبقى الأفضل
