stars,review,district,governorate,clean_review
5,"أنا عايز أقول إن خدمة التموين دي رائعة فعلا, لأنها بتوفر لنا كل اللي نحتاجه وبسرعة. شكرا على المجهود ده!",مكتب المدينة للغذاء,القاهرة,أنا عايز أقول إن خدمة التموين دي رائعة فعلا لأنها بتوفر لنا كل اللي نحتاجه وبسرعة شكرا على المجهود ده
1,"للأسف الشديد, أنا آسف لقول ذلك لكن خدمة التموين فى محافظتنا مش كويسة خالص! دايما بتأخروا معانا وبتقولوا حاجات مش موجودة أصلا! لو كنت مكانهم هغير كل العاملين هناك علشان الناس اللى بيستحملوا ده كفاية. #السويس_بلازمي",جمعية خيركم للغذاء,السويس,للأسف الشديد أنا آسف لقول ذلك لكن خدمة التموين فى محافظتنا مش كويسة خالص دايما بتأخروا معانا وبتقولوا حاجات مش موجودة أصلا لو كنت مكانهم هغير كل العاملين هناك علشان الناس اللى بيستحملوا ده كفاية السويسبلازمي
1,"أنا مش راضي نهائيا على خدمة التموين دي, أنا شايف إنها بقت أسوأ كل يوم بدل ما تتحسن. الأكل اللي بيقدموله لينا ده كله زي الورق المقوي! ولازم الحكومة تعمل حاجة علشان الناس تروح تغدي.",جمعية غذاء,سوهاج,أنا مش راضي نهائيا على خدمة التموين دي أنا شايف إنها بقت أسوأ كل يوم بدل ما تتحسن الأكل اللي بيقدموله لينا ده كله زي الورق المقوي ولازم الحكومة تعمل حاجة علشان الناس تروح تغدي
5,"أنا سعيد جدا بخدمة التموين دي! هي فعلا ممتازة ومش هتقدر تستغني عنها, ربنا يبارك فيها ويبارك اللي بيقدموها للناس. شكرا جزيلا على اهتمامكم ودعمكم المستمر لينا كل يوم.",شركة مروة للطعام,مطروح,أنا سعيد جدا بخدمة التموين دي هي فعلا ممتازة ومش هتقدر تستغني عنها ربنا يبارك فيها ويبارك اللي بيقدموها للناس شكرا جزيلا على اهتمامكم ودعمكم المستمر لينا كل يوم
3,"أنا مش عارف أقول ايه, بس بصراحة الخدمات بتكون وحشانة جدا! كل مرة بنروح ونطلب حاجات كتير بيقولو مفيش وكمان الأسعار بقت غالية أوي! لازم يتحلوا المشكلة دي بسرعة قبل ما الناس تفقد الأمل تماما!",جمعية الحياة,القاهرة,أنا مش عارف أقول ايه بس بصراحة الخدمات بتكون وحشانة جدا كل مرة بنروح ونطلب حاجات كتير بيقولو مفيش وكمان الأسعار بقت غالية أوي لازم يتحلوا المشكلة دي بسرعة قبل ما الناس تفقد الأمل تماما
2,"أنا مش راضيا على مستوى الخدمة ده خالص, يعني لو بتعملها صح كنت حصلت على تقييم أعلى. الخدمات العامة لازم تتحسن علشان الناس تقدر تعيش حياة أفضل.",مكتب الرابطة,الإسكندرية,أنا مش راضيا على مستوى الخدمة ده خالص يعني لو بتعملها صح كنت حصلت على تقييم أعلى الخدمات العامة لازم تتحسن علشان الناس تقدر تعيش حياة أفضل
1,"أنا مش راضي على خدمات التموين, دايما بنشوف مشاكل كتير في التوصيل والتاخير, ونفسي الحكومة تهتم أكثر بمييزتنا.",الجمعية المصرية لتغذية الأسرة,البحيرة,أنا مش راضي على خدمات التموين دايما بنشوف مشاكل كتير في التوصيل والتاخير ونفسي الحكومة تهتم أكثر بمييزتنا
1,"أنا مش راضي تماما على خدمة التموين في المحافظة, هي بتتأخر كتير أوي ومش دايما بتنزل الكمية الكافية للناس اللي محتاجينها.",مكتب التموين السعيد,الفيوم,أنا مش راضي تماما على خدمة التموين في المحافظة هي بتتأخر كتير أوي ومش دايما بتنزل الكمية الكافية للناس اللي محتاجينها
2,"أنا مش عارفة أحكي إيه بخصوص خدمات التموين, بس بصراحة دي حاجة مزرية جدا. احنا لازم نغير نظام التوزيع ده ونوفر للناس حاجات أفضل quality. I think we need to start a campaign to improve the situation and make sure everyone gets their fair share of food.",مكتب جمعية نور,القاهرة,أنا مش عارفة أحكي إيه بخصوص خدمات التموين بس بصراحة دي حاجة مزرية جدا احنا لازم نغير نظام التوزيع ده ونوفر للناس حاجات أفضل
5,"أنا سعيد جدا بخدمة التموين في المحافظة, إنها فعلا ممتازة! كل شيء كان منظم ومريح, حتى الأكل كان لذيذ وبأسعار معقولة. شكرا جزيلا على هذا الجهد الرائع, وأتمنى لكم المزيد من النجاح والتقدم دائما.",مكتب خيرنا,الإسماعيلية,أنا سعيد جدا بخدمة التموين في المحافظة إنها فعلا ممتازة كل شيء كان منظم ومريح حتى الأكل كان لذيذ وبأسعار معقولة شكرا جزيلا على هذا الجهد الرائع وأتمنى لكم المزيد من النجاح والتقدم دائما
4,"أنا سعيد جدا لتقديم تعليقات على خدمات التموين! لقد كنت أستخدمها منذ فترة طويلة وأعتقد أنها حقا تساعد الناس المحتاجين. ولكن, هناك بعض المشاكل التي واجهتها مؤخرا. أتمنى لو أنهم يحلونها بسرعة عشان نقدر نستفيد منها بشكل أفضل. شكرا جزيلا لكم!",مكتب نور بنى سويف,بني سويف,أنا سعيد جدا لتقديم تعليقات على خدمات التموين لقد كنت أستخدمها منذ فترة طويلة وأعتقد أنها حقا تساعد الناس المحتاجين ولكن هناك بعض المشاكل التي واجهتها مؤخرا أتمنى لو أنهم يحلونها بسرعة عشان نقدر نستفيد منها بشكل أفضل شكرا جزيلا لكم
1,"أنا مش عايز أقول أي حاجة سلبية, لكن الحقيقة هي أنه حتى الآن, الخدمات التموينية ليست على المستوى المطلوب. أحيان كتير بنلاقي مشاكل في التوصيل وفي الفواتير كمان, ومش عارفين ليه بيحصل كدا. أتمنى لو يتغير الوضع قريب لأن احنا محتاجين كل الدعم اللي ممكن نحصل عليه.",اتحاد التموين البحري في المحافظة,البحيرة,أنا مش عايز أقول أي حاجة سلبية لكن الحقيقة هي أنه حتى الآن الخدمات التموينية ليست على المستوى المطلوب أحيان كتير بنلاقي مشاكل في التوصيل وفي الفواتير كمان ومش عارفين ليه بيحصل كدا أتمنى لو يتغير الوضع قريب لأن احنا محتاجين كل الدعم اللي ممكن نحصل عليه
4,"أنا سعيد جدا بتلقي هذا التقييم الإيجابي للخدمة التموينية في محافظتي الحبيبة, أسيوط! على الرغم من أنني لم أتمكن من الاستفادة منها بنفسي بسبب بعض المشاكل الفنية التي واجهتها مؤخرا, إلا أنه يبدو أنها تعمل بشكل جيد بالنسبة للآخرين. أتطلع إلى تحسين خدمتنا وتقديم المزيد من الراحة للمواطنين المصريين مثل نفسي. شكرا جزيلا لكم جميعا على دعمكم المستمر وعلى إعطائي الفرصة لأكون جزءًا من مجتمع مصر العظيم.",جمعية السلام للضيافة,أسيوط,أنا سعيد جدا بتلقي هذا التقييم الإيجابي للخدمة التموينية في محافظتي الحبيبة أسيوط على الرغم من أنني لم أتمكن من الاستفادة منها بنفسي بسبب بعض المشاكل الفنية التي واجهتها مؤخرا إلا أنه يبدو أنها تعمل بشكل جيد بالنسبة للآخرين أتطلع إلى تحسين خدمتنا وتقديم المزيد من الراحة للمواطنين المصريين مثل نفسي شكرا جزيلا لكم جميعا على دعمكم المستمر وعلى إعطائي الفرصة لأكون جزءا من مجتمع مصر العظيم
4,"أنا سعيد جدا بتلقي التغذية المدرسية! إنها تعطيني طاقة جديدة للحياة اليومية, وأنا ممتن لكل وجبة أتناولها فيها. ولكن أتمنى لو كان هناك المزيد من التنوع في الطعام حتى يكون أكثر شهية, لأن بعض الأيام أكون مشوش على نفس الأشياء. بالرغم من ذلك, أقدر مجهودات الحكومة لتوفير هذا البرنامج للأطفال الصغار مثلنا. شكرا لكم جميعا!",مكتب الأعمال الغذائية,أسيوط,أنا سعيد جدا بتلقي التغذية المدرسية إنها تعطيني طاقة جديدة للحياة اليومية وأنا ممتن لكل وجبة أتناولها فيها ولكن أتمنى لو كان هناك المزيد من التنوع في الطعام حتى يكون أكثر شهية لأن بعض الأيام أكون مشوش على نفس الأشياء بالرغم من ذلك أقدر مجهودات الحكومة لتوفير هذا البرنامج للأطفال الصغار مثلنا شكرا لكم جميعا
5,"أنا سعيد جدا بتقديم خدمات التموين الممتازة التي نقدمها هنا في مدينة بورسعيد! كل شيء يتم تنظيمه بشكل مثالي, ونستطيع دائما الحصول على الطعام اللذيذ والمفيد بسعر مناسب. شكرا جزيلا لكم جميعا على هذا العمل الرائع!",مكتب السعادة,بورسعيد,أنا سعيد جدا بتقديم خدمات التموين الممتازة التي نقدمها هنا في مدينة بورسعيد كل شيء يتم تنظيمه بشكل مثالي ونستطيع دائما الحصول على الطعام اللذيذ والمفيد بسعر مناسب شكرا جزيلا لكم جميعا على هذا العمل الرائع
2,"أنا مش عارف أقول إيه, لكن أعتقد إن نظام التوزيع ده محتاج تطوير كبير عشان يكون أفضل. للأسف دي التجربة الوحيدة لي مع التموين ولازم أحكي عنها كده!",مكتب الأعمال الغذائية,أسيوط,أنا مش عارف أقول إيه لكن أعتقد إن نظام التوزيع ده محتاج تطوير كبير عشان يكون أفضل للأسف دي التجربة الوحيدة لي مع التموين ولازم أحكي عنها كده
4,"أنا سعيد جدا بالخدمة التموينية اللي حصلت عليها من المحافظة, بس للأسف مش كل مرة يكون التسليم على الوقت المحدد, وأنا بتوقع إنهم يعملوا حاجة علشان الناس تستريح شوية ويارب يكونوا فهموني.",مكتب الرابطة الغذائية,البحيرة,أنا سعيد جدا بالخدمة التموينية اللي حصلت عليها من المحافظة بس للأسف مش كل مرة يكون التسليم على الوقت المحدد وأنا بتوقع إنهم يعملوا حاجة علشان الناس تستريح شوية ويارب يكونوا فهموني
4,"أنا مش فاهم حاجه, ده كله كلام متكلم! لو سمحت ممكن توضحلي أكتر?",جمعية التعاون الغذائي,البحيرة,أنا مش فاهم حاجه ده كله كلام متكلم لو سمحت ممكن توضحلي أكتر
2,"أنا مش راضيين عن جودة الأكل ده, دايما بيكون بارد ومش طعمه حلو زي الأول. لو عايزين الناس تقدر على الموقع الاجتماعي بجد لازم يتحسنوا أوي.",الجمعية المصرية للغذاء,القاهرة,أنا مش راضيين عن جودة الأكل ده دايما بيكون بارد ومش طعمه حلو زي الأول لو عايزين الناس تقدر على الموقع الاجتماعي بجد لازم يتحسنوا أوي
3,"أنا مش راضي خالص عن خدمة التموين دي, والله لو أديك تقييمها ب4/5 كنت أفضل حالا!",الجمعية التعاونية للطعام الصحي,الإسكندرية,أنا مش راضي خالص عن خدمة التموين دي والله لو أديك تقييمها ب كنت أفضل حالا
3,"أنا بتكلم عن خدمات التموين في القاهرة, أنا بعتبرها كويسة بالنسبة للدرجة دي, لكن مش زيما كانت قبل كده. كنت بتحصل كل اللي تحتاجه وبجده بس دلوقتي لازم تروح كتير مرة عشان تحصل على الحاجات الأساسية.",مكتب الشروق للتوريدات الغذائية,القاهرة,أنا بتكلم عن خدمات التموين في القاهرة أنا بعتبرها كويسة بالنسبة للدرجة دي لكن مش زيما كانت قبل كده كنت بتحصل كل اللي تحتاجه وبجده بس دلوقتي لازم تروح كتير مرة عشان تحصل على الحاجات الأساسية
5,"أنا سعيد جدا بالخدمة اللي قدمتها, مش عارف إزاي أقدرها أكتر! كانت ممتازة بكل المقاييس, الأكل كان طازج ومعد بشكل صحيح والموظفين كانوا لطفاء ومهنيين. أتمنى أنهم يستمرون على هذا المستوى لأن ده حاجة عظيمة للبلد كلها. شكرا جزيلا يا وزارة التموين! #وزارة_التموين_المصرية",مكتب المدينة للغذاء,القاهرة,أنا سعيد جدا بالخدمة اللي قدمتها مش عارف إزاي أقدرها أكتر كانت ممتازة بكل المقاييس الأكل كان طازج ومعد بشكل صحيح والموظفين كانوا لطفاء ومهنيين أتمنى أنهم يستمرون على هذا المستوى لأن ده حاجة عظيمة للبلد كلها شكرا جزيلا يا وزارة التموين وزارةالتموينالمصرية
4,"أنا سعيد بتقديم تقييمي للخدمة التموينية في الاسماعيلية, على الرغم من أنها ليست مثالية ولكنها مقبولة بالنسبة لي. أتمنى تحسينها أكثر للأفضل.",مكتب الأمل,الإسماعيلية,أنا سعيد بتقديم تقييمي للخدمة التموينية في الاسماعيلية على الرغم من أنها ليست مثالية ولكنها مقبولة بالنسبة لي أتمنى تحسينها أكثر للأفضل
2,"أنا مش عارفة أقول رأيك, بس أعتقد أنه يمكن يتحسن شوية لو عملوا بعض التعديلات الصغيرة على طريقة التوصيل والتقديم. وكمان نقدر نفضل نشوف المزيد من التنوع في الأطباق المتاحة. شكرا!",جمعية الواحة,السويس,أنا مش عارفة أقول رأيك بس أعتقد أنه يمكن يتحسن شوية لو عملوا بعض التعديلات الصغيرة على طريقة التوصيل والتقديم وكمان نقدر نفضل نشوف المزيد من التنوع في الأطباق المتاحة شكرا
3,"أنا مش راضيا جدا على خدمات التموين في المحافظة, لأن دايما بنشوف مشاكل وحاجات كتير بتتأخر. لكن أتمنى أنهم يحسنوا الأداء ويتعاملوا مع كل الشكاوى بسرعة وكفاءة أكبر.",مكتب التغذية,السويس,أنا مش راضيا جدا على خدمات التموين في المحافظة لأن دايما بنشوف مشاكل وحاجات كتير بتتأخر لكن أتمنى أنهم يحسنوا الأداء ويتعاملوا مع كل الشكاوى بسرعة وكفاءة أكبر
4,"أنا سعيد جدا بتلقي هذا التعليق الإيجابي على خدمتنا للتوصيل! نحن نقدر دعمكم ونعمل بجد لتقديم أفضل تجربة ممكنة لكل عملائنا الكرام. شكرا لكم, وأتمنى لكم يوما سعيدا!",المكتب المصري لتوريد الأغذية,الغربية,أنا سعيد جدا بتلقي هذا التعليق الإيجابي على خدمتنا للتوصيل نحن نقدر دعمكم ونعمل بجد لتقديم أفضل تجربة ممكنة لكل عملائنا الكرام شكرا لكم وأتمنى لكم يوما سعيدا
1,"أنا مش راضيه عن خدمات التموين في محافظتنا, احنا بنستنا من زمان ونريد تحسينات حقيقية عشان نقدر نعيش حياة أفضل.",مكتب الطعام الصحي,قنا,أنا مش راضيه عن خدمات التموين في محافظتنا احنا بنستنا من زمان ونريد تحسينات حقيقية عشان نقدر نعيش حياة أفضل
1,"أنا مش راضيا على خدمات التموين دي خالص! مفيش جودة ولا احترام للعملاء, كل مرة لازم نكرر نفس الكلام ونطالب بتحسين الخدمات علشان نقدر نستفيد منها بشكل صحيح.",مكتب الطعام الصحي,الإسكندرية,أنا مش راضيا على خدمات التموين دي خالص مفيش جودة ولا احترام للعملاء كل مرة لازم نكرر نفس الكلام ونطالب بتحسين الخدمات علشان نقدر نستفيد منها بشكل صحيح
4,"الحمد لله على كل حال, أنا راضي تماما عن خدمات التموين اللي بنحصل عليها هنا في الجيزة. بس فيه بعض الأوقات بتكون طويلة جدا ومليانة ناس, لكن بشكل عام هي كويسة.",اتحاد مطبخ الحياة,الجيزة,الحمد لله على كل حال أنا راضي تماما عن خدمات التموين اللي بنحصل عليها هنا في الجيزة بس فيه بعض الأوقات بتكون طويلة جدا ومليانة ناس لكن بشكل عام هي كويسة
5,"أنا سعيد جدا بخدمة التموين في محافظة السويس! إنها بالفعل ممتازة وتفي بتوقعاتي تماما. الطعام لذيذ والشاي حلو, والأفضل من ذلك كله أنه يأتي بانتظام وفي الوقت المحدد بالضبط. شكرا جزيلا على هذا العرض الرائع!",مكتب الحياة,السويس,أنا سعيد جدا بخدمة التموين في محافظة السويس إنها بالفعل ممتازة وتفي بتوقعاتي تماما الطعام لذيذ والشاي حلو والأفضل من ذلك كله أنه يأتي بانتظام وفي الوقت المحدد بالضبط شكرا جزيلا على هذا العرض الرائع
5,"أنا مش عارف إيه اللي بيحصل, النهاردة جبتلي أكلة تونة وحمص على الفطار, لكن كان فيها حاجة غريبة جدا! كانت التونة بتتبل بالملح والفلفل بس, ولا حتى أي خلطة تاني!",جمعية السندس,القليوبية,أنا مش عارف إيه اللي بيحصل النهاردة جبتلي أكلة تونة وحمص على الفطار لكن كان فيها حاجة غريبة جدا كانت التونة بتتبل بالملح والفلفل بس ولا حتى أي خلطة تاني
4,"أنا مش عارف أقول ايه على خدمة التموين, لكن بصراحة هي ليست بأفضل حال. أنا أعطيها أربعة من أصل خمسة لأن ممكن يكون أحسن بكتير. ولكن لو عايزين نقدر فعلا لازم نعمل بعض التغييرات ونبذل مجهود أكبر علشان نكون قادرين على تقديم خدمات أفضل للمواطنين.",مكتب إمداد الغربية,الغربية,أنا مش عارف أقول ايه على خدمة التموين لكن بصراحة هي ليست بأفضل حال أنا أعطيها أربعة من أصل خمسة لأن ممكن يكون أحسن بكتير ولكن لو عايزين نقدر فعلا لازم نعمل بعض التغييرات ونبذل مجهود أكبر علشان نكون قادرين على تقديم خدمات أفضل للمواطنين
4,أنا سعيد جدا بأن خدمتي للتموين حصلت على تقييم أربعة من أصل خمس نجوم! هذا يعني أنني راضٍ تمامًا عنها وأقدر الجهود التي يبذلها الموظفون للحفاظ على نظافة الطعام وتنظيمه بشكل جيد كل يوم. أتمنى أن تستمر الخدمة في التحسن وأن يستمتع الجميع بوجباتهم الصحية واللذيذة. شكرا لكم جميعا.,الجمعية التعاونية للطعام الصحي,الإسكندرية,أنا سعيد جدا بأن خدمتي للتموين حصلت على تقييم أربعة من أصل خمس نجوم هذا يعني أنني راض تماما عنها وأقدر الجهود التي يبذلها الموظفون للحفاظ على نظافة الطعام وتنظيمه بشكل جيد كل يوم أتمنى أن تستمر الخدمة في التحسن وأن يستمتع الجميع بوجباتهم الصحية واللذيذة شكرا لكم جميعا
5,"أنا سعيد جدا بالخدمة اللي بنعملها, بس أنا عايزهم يضيفوا بعض الاختيارات الجديدة عشان الناس تقدر تختار منها.",جمعية طيبة للإطعام,سوهاج,أنا سعيد جدا بالخدمة اللي بنعملها بس أنا عايزهم يضيفوا بعض الاختيارات الجديدة عشان الناس تقدر تختار منها
4,أنا سعيد جدا بأن خدمتي التموينية حصلت على تقييم جيد من قبلك! أقدر كل التعليقات الإيجابية التي أتلقاها وأعمل بجد لتحسين خدماتي بشكل مستمر لتلبية احتياجاتكم وتوقعاتكم. شكرا لك مرة أخرى وأتمنى لكم يوم رائع.,مكتب التموين الدائم,دمياط,أنا سعيد جدا بأن خدمتي التموينية حصلت على تقييم جيد من قبلك أقدر كل التعليقات الإيجابية التي أتلقاها وأعمل بجد لتحسين خدماتي بشكل مستمر لتلبية احتياجاتكم وتوقعاتكم شكرا لك مرة أخرى وأتمنى لكم يوم رائع
1,"أنا مش عارف أتكلم بصراحة, لكن بصراحة, خدمة التموين دي بتطلعنا للوراء! كل يوم بنشوف حاجات جديدة بتصعب علينا الحياة, وبنعمل اللي نقدر عليه علشان نعيش. احنا محتاجين نتقدم ونغير الأمور للأفضل.",مجلس الأزرقي,بورسعيد,أنا مش عارف أتكلم بصراحة لكن بصراحة خدمة التموين دي بتطلعنا للوراء كل يوم بنشوف حاجات جديدة بتصعب علينا الحياة وبنعمل اللي نقدر عليه علشان نعيش احنا محتاجين نتقدم ونغير الأمور للأفضل
